Video ID,Comment ID,comments,Likes,polarity,pol_cat,stop_comments
MwpMEbgC7DA,UgxxSj1_Pqw-r_FDpqh4AaABAg,reasons  why  you  should  stay  alive          1    we  would  miss  you      2    it's  not  worth  the  regret    either  by  yourself  if  you  failed  or  just  simply  left  scars    or  the  regret  everyone  else  feels  by  not  doing  enough  to  help  you      3    it  does  get  better    believe  it  or  not  it  will  eventually  get  better    sometimes  you  have  to  go  through  the  storm  to  get  to  the  rainbow      4    there's  so  much  you  would  miss  out  on  doing      5    there  is  always  a  reason  to  live    it  might  not  be  clear  right  now    but  it  is  always  there      6    so  many  people  care    and  it  would  hurt  them  if  you  hurt  yourself      7    you  are  worth  it    don't  let  anyone    especially  yourself    tell  you  otherwise      8    you  are  amazing      9    a  time  will  come    once  you've  battled  the  toughest  times  of  your  life  and  are  in  ease  once  again    where  you  will  be  so  glad  that  you  decided  to  keep  on  living    you  will  emerge  stronger  from  this  all    and  won't  regret  your  choice  to  carry  on  with  life    because  things  always  get  better      10    what  about  all  the  things  you've  always  wanted  to  do    what  about  the  things  you've  planned    but  never  got  around  to  doing    you  can't  do  them  when  you're  dead      11    i  love  you    even  if  only  one  person  loves  you    that's  still  a  reason  to  stay  alive      12    you  won't  be  able  to  listen  to  music  if  you  die      13    killing  yourself  is  never  worth  it    you'll  hurt  both  yourself  and  all  the  people  you  care  about      14    there  are  so  many  people  that  would  miss  you    including  me      15    you're  preventing  a  future  generation    your  kids    from  even  being  born      16    how  do  you  think  your  family  would  feel    would  it  improve  their  lives  if  you  died      17    you're  gorgeous    amazing    and  to  someone  you  are  perfect      18    think  about  your  favourite  music  artist    you'll  never  hear  their  voice  again          19    you'll  never  have  the  feeling  of  walking  into  a  warm  building  on  a  cold  day    20    listening  to  incredibly  loud  music    21    being  alive  is  just  really  good      22    not  being  alive  is  really  bad      23    finding  your  soulmate      24    red  pandas    25    going  to  diners  at  three  in  the  morning      26    really  soft  pillows      27    eating  pizza  in  new  york  city      28    proving  people  wrong  with  your  success      29    watching  the  jerks  that  doubted  you  fail  at  life      30    seeing  someone  trip  over  a  garbage  can      31    being  able  to  help  other  people      32    bonfires      33    sitting  on  rooftops      34    seeing  every  single  country  in  the  world      35    going  on  roadtrips      36    you  might  win  the  lottery  someday      37    listening  to  music  on  a  record  player      38    going  to  the  top  of  the  eiffel  tower      39    taking  really  cool  pictures      40    literally  meeting  thousands  of  new  people      41    hearing  crazy  stories      42    telling  crazy  stories      43    eating  ice  cream  on  a  hot  day      44    more  harry  potter  books  could  come  out    you  never  know      45    travelling  to  another  planet  someday      46    having  an  underwater  house      47    randomly  running  into  your  hero  on  the  street      48    having  your  own  room  at  a  fancy  hotel      49    trampolines      50    think  about  your  favourite  movie    you'll  never  watch  it  again      51    think  about  the  feeling  of  laughing  out  loud  in  a  public  place  because  your  best  friend  has  just  sent  you  an  inside  joke      52    your  survival  will  make  the  world  better    even  if  it's  for  just  one  person  or  20  or  100  or  more      53    people  do  care      54    treehouses    55    hanging  out  with  your  soul  mate  in  a  treehouse    55    snorting  when  you  laugh  and  not  caring  who  sees    56    i  don't  even  know  you  and  i  love  you      57    i  don't  even  know  you  and  i  care  about  you      58    because  nobody  is  going  to  be  like  you  ever    so  embrace  your  uniqueness      59    you  won't  be  here  to  experience  the  first  cat  world  emperor      60    what  about  food      you'll  miss  chocolate  and  all  the  other  nom  things      61    starbucks      62    hugs      63    stargazing      64    you  have  a  purpose    and  it's  up  to  you  to  find  out  what  it  is      65    you've  changed  somebody's  life      66    now  you  could  change  the  world      67    you  will  meet  the  person  that's  perfect  for  you      68    no  matter  how  much  or  how  little    you  have  your  life  ahead  of  you      69    you  have  the  chance  to  save  somebody's  life      70    if  you  end  your  life    you're  stopping  yourself  from  achieving  great  things      71    making  snow  angels      72    making  snowmen      73    snowball  fights      74    life  is  what  you  make  of  it      75    everybody  has  a  talent      76    laughing  until  you  cry      77    having  the  ability  to  be  sad  means  you  have  the  ability  to  be  happy      78    the  world  would  not  be  the  same  if  you  didn't  exist      79    its  possible  to  turn  frowns    upside  down    80    be  yourself    don't  take  anyone's  shit    and  never  let  them  take  you  alive      81    heroes  are  ordinary  people  who  make  themselves  extraordinary    be  your  own  hero      82    being  happy  doesn't  mean  that  everything  is  perfect    it  means  that  you've  decided  to  look  beyond  the  imperfections      83    one  day  your  smile  will  be  real      84    having  a  really  hot    relaxing  bath  after  a  stressful  day      85    lying  on  grass  and  laughing  at  the  clouds      86    getting  completely  smashed  with  your  best  friends      87    eating  crazy  food      88    staying  up  all  night  watching  your  favourite  films  with  a  loved  one      89    sleeping  in  all  day      90    creating  something  you're  proud  of      91    you  can  look  back  on  yourself  70  years  later  and  being  proud  you  didn't  commit    92    being  able  to  meet  your  internet  friends      93    tea      coffee      hot  chocolate    94    the  new  season  of  sherlock  95    cuddling  under  the  stars      96    being  stupid  in  public  because  you  just  can      97    if  you  are  reading  this  then  you  are  alive    is  there  any  more  reason  to  smile      98    being  able  to  hug  that  one  person  you  havent  seen  in  years    99    people  care  enough  about  you  and  your  future  to  come  up  with  100  reasons  for  you  not  to  do  this      100    but    the  final  and  most  important  one  is    just    being  able  to  experience  life    because  even  if  your  life  doesn't  seem  so  great  right  now    literally  anything  could  happen        from  someone  that  cares  about  you    3,5080,0.2154928918817808,1,reasons stay alive 1 would miss 2 's worth regret either failed simply left scars regret everyone else feels enough help 3 get better believe eventually get better sometimes go storm get rainbow 4 's much would miss 5 always reason live might clear right always 6 many people care would hurt hurt 7 worth n't let anyone especially tell otherwise 8 amazing 9 time come 've battled toughest times life ease glad decided keep living emerge stronger wo n't regret choice carry life things always get better 10 things 've always wanted things 've planned never got around ca n't 're dead 11 love even one person loves 's still reason stay alive 12 wo n't able listen music die 13 killing never worth 'll hurt people care 14 many people would miss including 15 're preventing future generation kids even born 16 think family would feel would improve lives died 17 're gorgeous amazing someone perfect 18 think favourite music artist 'll never hear voice 19 'll never feeling walking warm building cold day 20 listening incredibly loud music 21 alive really good 22 alive really bad 23 finding soulmate 24 red pandas 25 going diners three morning 26 really soft pillows 27 eating pizza new york city 28 proving people wrong success 29 watching jerks doubted fail life 30 seeing someone trip garbage 31 able help people 32 bonfires 33 sitting rooftops 34 seeing every single country world 35 going roadtrips 36 might win lottery someday 37 listening music record player 38 going top eiffel tower 39 taking really cool pictures 40 literally meeting thousands new people 41 hearing crazy stories 42 telling crazy stories 43 eating ice cream hot day 44 harry potter books could come never know 45 travelling another planet someday 46 underwater house 47 randomly running hero street 48 room fancy hotel 49 trampolines 50 think favourite movie 'll never watch 51 think feeling laughing loud public place best friend sent inside joke 52 survival make world better even 's one person 20 100 53 people care 54 treehouses 55 hanging soul mate treehouse 55 snorting laugh caring sees 56 n't even know love 57 n't even know care 58 nobody going like ever embrace uniqueness 59 wo n't experience first cat world emperor 60 food 'll miss chocolate nom things 61 starbucks 62 hugs 63 stargazing 64 purpose 's find 65 've changed somebody 's life 66 could change world 67 meet person 's perfect 68 matter much little life ahead 69 chance save somebody 's life 70 end life 're stopping achieving great things 71 making snow angels 72 making snowmen 73 snowball fights 74 life make 75 everybody talent 76 laughing cry 77 ability sad means ability happy 78 world would n't exist 79 possible turn frowns upside 80 n't take anyone 's shit never let take alive 81 heroes ordinary people make extraordinary hero 82 happy n't mean everything perfect means 've decided look beyond imperfections 83 one day smile real 84 really hot relaxing bath stressful day 85 lying grass laughing clouds 86 getting completely smashed best friends 87 eating crazy food 88 staying night watching favourite films loved one 89 sleeping day 90 creating something 're proud 91 look back 70 years later proud n't commit 92 able meet internet friends 93 tea coffee hot chocolate 94 new season sherlock 95 cuddling stars 96 stupid public 97 reading alive reason smile 98 able hug one person havent seen years 99 people care enough future come 100 reasons 100 final important one able experience life even life n't seem great right literally anything could happen someone cares 3
MwpMEbgC7DA,UgxW6BsjSYof31hGUi54AaABAg,all  my  tears  have  been  used  all,0,0.0,0,tears used
MwpMEbgC7DA,UgzfVOcTj2rttLFSMiV4AaABAg,there's  this  sadness  and  disappointment  i  feel  when  i  come  across  a  great  song  and  find  out  it's  old    the  feelings  aren't  towards  the  song  for  being  old    but  towards  me  for  discovering  it  late,118,0.02000000000000001,1,'s sadness disappointment feel come across great song find 's old feelings n't towards song old towards discovering late
MwpMEbgC7DA,Ugxc5YCkTdSguRKdqr14AaABAg,where  the  hell  was  i  in  2012  when  this  was  released,4,0.0,0,hell 2012 released
MwpMEbgC7DA,UgxqCBq2xrx62CADKUN4AaABAg,weird  feeling  when  i  hear  it,0,-0.5,0,weird feeling hear
MwpMEbgC7DA,Ugz3avR7cnLsK8EQqrF4AaABAg,on  another  love,4,0.5,1,another love
MwpMEbgC7DA,UgxpD4yOYChCXmxTcCV4AaABAg,this  song  gives  you  hope  in  one  moment  and  breaks  you  down  in  the  next    it  is  beautifully  sad,419,-0.21851851851851853,0,song gives hope one moment breaks next beautifully sad
MwpMEbgC7DA,UgyptJKDsI7vIFRbBg94AaABAg,november  2021  let's  see  how  many  legends  listing  to  this  masterpiece,2,0.5,1,november 2021 let 's see many legends listing masterpiece
MwpMEbgC7DA,Ugx8UXpqzHLnzaU3kfx4AaABAg,im  lucky  my  tears  have  already  fallen  before  to  this  song  so  now  im  numb  to  it,0,-0.13333333333333333,0,im lucky tears already fallen song im numb
MwpMEbgC7DA,UgwC2WSvyPZTDvvLDMZ4AaABAg,it  doesn  t  matter  how  happy  you  are    this  song  will  make  you  sad,5252,0.15000000000000002,1,matter happy song make sad
MwpMEbgC7DA,UgzlnYDlmsGTnyoiQLJ4AaABAg,it  doesn't  matter  if  it  was  made  8  yrs  ago  its  still  the  best  song  of  2021,560,1.0,1,n't matter made 8 yrs ago still best song 2021
MwpMEbgC7DA,UgxCTwc3hTqVEqQxOcd4AaABAg,9  years  today  that  this  masterpiece  entered  the  word,1,0.0,0,9 years today masterpiece entered word
MwpMEbgC7DA,UgxDsvHdOuS8vPPFQ454AaABAg,evryone  here  has  a  story  with  someone  to  relate  with  this  song  and  im  here    relating  myself  forgiving  myself,3,0.0,0,evryone story someone relate song im relating forgiving
MwpMEbgC7DA,UgwhZNWFIds_isy1Jzp4AaABAg,for  those  who  still  can  t  understand  lyrics    i  finally  found  the  meaning  after  2  years        it  is  about  the  guy  who  was  in  hard  relationships      he  spent  all  his  energy  and  love  to  other  person  but  they  broke  up  anyway    after  his  last  relationships    he  found  the  love  of  his  life      the  one    but  he  had  lost  all  sense  to  love  and  be  loved    he  sings    i  wanna  cry  and  i  wanna  love    but  all  my  tears  have  been  used  up        he  still  wanna  love  his  gf    but  he  is  devastated,566,0.24393939393939396,1,still understand lyrics finally found meaning 2 years guy hard relationships spent energy love person broke anyway last relationships found love life one lost sense love loved sings wan na cry wan na love tears used still wan na love gf devastated
MwpMEbgC7DA,UgzubkCERZ_WuPBJbbJ4AaABAg,i  realized  that  i  was  sad  while  trying  not  to  upset  my  loved  ones    sometimes  we  shouldn't  care  too  much,0,0.13333333333333333,1,realized sad trying upset loved ones sometimes n't care much
MwpMEbgC7DA,Ugy5Bc2T5ZzBIFGciqp4AaABAg,a  crack  tom    love  u,0,0.5,1,crack tom love u
MwpMEbgC7DA,Ugy8OMnmJiFFbQYbyt54AaABAg,when  people  listen  to    you  broke  me  first    and    drivers  license    when  this  is  literally  the  saddest  song  ever,645,0.25,1,people listen broke first drivers license literally saddest song ever
MwpMEbgC7DA,UgxGYCjlsRLK8t3LjGN4AaABAg,it's    september  2021    let's  see  how  many  legends  are  listening  to  this  masterpiece,947,0.5,1,'s september 2021 let 's see many legends listening masterpiece
MwpMEbgC7DA,UgwfavQwQCNbFBYhcq54AaABAg,i  just  couldn't  find  a  word  to  express  how  beautiful  this  is,619,0.85,1,could n't find word express beautiful
MwpMEbgC7DA,Ugx1OyHbTR4iZ446yEp4AaABAg,it  s  crazy  that  probably  80    in  the  comments  here  are  in  pain,2,-0.6,0,crazy probably 80 comments pain
MwpMEbgC7DA,UgyatQ6PFz5u8eF-27h4AaABAg,btw  man  united  brought  u  here,0,0.0,0,btw man united brought u
MwpMEbgC7DA,UgyAAB41pMOFxSMU9i54AaABAg,2021  i  still  listen  this  masterpiece,2,0.0,0,2021 still listen masterpiece
MwpMEbgC7DA,Ugx_7jc7Vw_bHg7Zj0Z4AaABAg,this  song  will  make  you  sad  even  if  you  re  not,2668,-0.5,0,song make sad even
MwpMEbgC7DA,Ugwgz8A_CkEGYUGLfxV4AaABAg,imagine  this  song  with  a  little  bit    of  aurora,0,-0.1875,0,imagine song little bit aurora
MwpMEbgC7DA,UgyoFOuJHVVNjAr_6Q94AaABAg,you  can't  lie    we  all  cried  while  listening  to  this,550,0.0,0,ca n't lie cried listening
MwpMEbgC7DA,UgwAC9hag4ZbbfPTuxR4AaABAg,i  m  on  a  road  of  recovery  battling  with  mental  health  and  this  song  definitely  hits  different    it  just  reminds  me  of  all  the  dark  moments  i  ve  been  through  and  a  part  of  me  now  holds  on  to  it  just  to  prove  to  myself  in  the  future  that  i  can  get  through  this    to  anyone  that  s  suffering  you  are  not  alone  keep  going,39,-0.05,0,road recovery battling mental health song definitely hits different reminds dark moments part holds prove future get anyone suffering alone keep going
MwpMEbgC7DA,UgxpAeWg2LFz4x0UR7V4AaABAg,i  know  exactly  what  he  means,1,0.25,1,know exactly means
MwpMEbgC7DA,Ugzt8Vw-hcFFNA6hp3h4AaABAg,bro  this  song  hits  deep  for  me  rn,1,0.0,0,bro song hits deep rn
MwpMEbgC7DA,Ugy5HRdcV3I3JlUgHk54AaABAg,i'm  crying  listening  to  this  song  and  i  think  my  mom  is  going  to  die    i  hope  nothing  happens,18,-0.2,0,'m crying listening song think mom going die hope nothing happens
MwpMEbgC7DA,UgwC_5tODVu1YbgbNZB4AaABAg,it  took  me  8  years  to  realise  this  is  one  of  the  best  songs  ever,493,1.0,1,took 8 years realise one best songs ever
MwpMEbgC7DA,UgxOZUXpsjhjwjPdVa94AaABAg,when  you  want  to  start  living  but  it  seems  impossibile  and  useless    when  you  want  to  appreciate  what  life  gave  you  but  you  can  t    when  you  want  lo  love  but  you  know  that  maybe  is  impossible  to  love  in  the  same  way  you  did    when  you  feel  empty  just  because  of  another  love  that  made  you  understand  you  weren  t  anyone  except  the  couple  you  created    when  this  love  finishes  you  stop  existing,3,0.09166666666666667,1,want start living seems impossibile useless want appreciate life gave want lo love know maybe impossible love way feel empty another love made understand anyone except couple created love finishes stop existing
MwpMEbgC7DA,UgxyuWoTqvY8dKrnBEF4AaABAg,everyone  talks  about  the  song  but  he  s  voice  is  so  calming,42,0.0,0,everyone talks song voice calming
MwpMEbgC7DA,UgyjTouhvgTJ1gu0-7p4AaABAg,i  love  this  song,0,0.5,1,love song
MwpMEbgC7DA,Ugy00t8FwsU5EanfOCV4AaABAg,august  2021    this  masterpiece  never  get  old,892,0.1,1,august 2021 masterpiece never get old
MwpMEbgC7DA,UgzFJS4lxxen0P8zf3R4AaABAg,it  s  been  9  years  guys  who  s  listening  to  this  masterpiece,3,0.0,0,9 years guys listening masterpiece
MwpMEbgC7DA,Ugyu8qc_JmTnVGzTCH14AaABAg,still  can't  cry        on  another  love      yea  i  knw  he'll  leave  me  on  another  day,1,0.5,1,still ca n't cry another love yea knw 'll leave another day
MwpMEbgC7DA,Ugz2tpyWz7RNM_7ySWp4AaABAg,mgk  s  far  cousin,0,0.1,1,mgk far cousin
MwpMEbgC7DA,UgwmGEe7lVZ6SN-YKVB4AaABAg,to  the  future  ones      please  don't  let  this  masterpiece  die      stuck  in  my  mind  so  badly,7,-0.3499999999999999,0,future ones please n't let masterpiece die stuck mind badly
MwpMEbgC7DA,UgwB1krqyzrMgK7g9fp4AaABAg,bro  ik  this  is  so  random  but  this  song  reminds  me  of  muhumad  ali  or  mike  jordan    idk  why  this  song  just  gives  me  leadership  vibes,0,-0.5,0,bro ik random song reminds muhumad ali mike jordan idk song gives leadership vibes
MwpMEbgC7DA,Ugw0cKgPT1rT3A4h7pl4AaABAg,don  t  worry  you  re  not  the  only  one  listening  to  this  masterpiece  in  june  2021,1479,0.0,0,worry one listening masterpiece june 2021
MwpMEbgC7DA,UgzrvYWqM6XpicxxYyp4AaABAg,i  can  t  believe  this  song  came  out  9  years  ago  i  just  found  it  on  tiktok  i  thought  it  was  new,1,0.13636363636363635,1,believe song came 9 years ago found tiktok thought new
MwpMEbgC7DA,UgxcAe9kQkrtExi_N-l4AaABAg,cried  to  this  at  15    crying  again  at  20,267,-0.2,0,cried 15 crying 20
MwpMEbgC7DA,UgwEFa8B-RTsOR5n3IJ4AaABAg,this  is  the  only  song  that  actually  almost  made  me  kinda  cry  and  i  ain  t  a  crier  wtf,0,-0.16666666666666666,0,song actually almost made kinda cry crier wtf
MwpMEbgC7DA,UgxAIow1Xkh884IL9V94AaABAg,timeless  classic    3,8981,0.16666666666666666,1,timeless classic 3
MwpMEbgC7DA,UgySgpIt4mhcqGTpXV14AaABAg,is  all  okay  bro,1,0.5,1,okay bro
MwpMEbgC7DA,UgwYx5yzhnmMCLoh5y54AaABAg,1  36  aaa  this  part,1,0.0,0,1 36 aaa part
MwpMEbgC7DA,UgzU3EUWe-LodaU_5gF4AaABAg,im  from  germany  im  sitting  on  a  table  und  i  cry  because  my  girlfriend  dont  love  me        but  is  love,1,0.5,1,im germany im sitting table und cry girlfriend dont love love
MwpMEbgC7DA,UgzSvc4qEQoVZBiuEVJ4AaABAg,my  music  teacher  played  this  for  us  last  week  in  class,0,0.0,0,music teacher played us last week class
MwpMEbgC7DA,Ugw2EgRohlb-iI1E9O14AaABAg,the  worst  day  of  loving  someone  is  the  day  you  lose  them,508,-0.2,0,worst day loving someone day lose
MwpMEbgC7DA,UgzcWe2iQjxXCYA4kkF4AaABAg,i  don't  know  how  i  would  live  without  music  lol,0,0.4681818181818182,1,n't know would live without music lol
MwpMEbgC7DA,UgzcAW_AanGs992biBR4AaABAg,omg  it  s  so  old,1,0.1,1,omg old
MwpMEbgC7DA,Ugza1c-b4K8eo8mRfn94AaABAg,october  2021    this  song  so  amazing,0,0.6000000000000001,1,october 2021 song amazing
MwpMEbgC7DA,UgxcG77SjImTGYF80iJ4AaABAg,bro      2012          its  like  10  years  ago  man,0,0.0,0,bro 2012 like 10 years ago man
MwpMEbgC7DA,Ugxf7xhB-mVZjFM3cZl4AaABAg,we  will  enter  2022  and  i  still  have  fillings  in  this  song,1,0.0,0,enter 2022 still fillings song
MwpMEbgC7DA,Ugx9VctwB9HZb0-UZZJ4AaABAg,l  love  this  song,2,0.5,1,l love song
MwpMEbgC7DA,UgxubaQnVelACUZZXo54AaABAg,9  years        9  years  of  this  greatness,3,0.0,0,9 years 9 years greatness
MwpMEbgC7DA,UgxQVw46r1z5f-CXgMV4AaABAg,legends  watch    this  in  2030,2,0.0,0,legends watch 2030
MwpMEbgC7DA,UgzhehjnNl0FQXIh-Kl4AaABAg,this  song  is  nostalgic  in  some  way    sad    happy      this  song  is  epic    his  voice  is  magical,36,0.08,1,song nostalgic way sad happy song epic voice magical
MwpMEbgC7DA,UgwyYXxk9MgQZWdBdsl4AaABAg,me      silently  wishing  for  a  collab  with  billie,1,0.0,0,silently wishing collab billie
MwpMEbgC7DA,UgyJvpIwLTAm8jm1NBl4AaABAg,why  take  life  so  seriously    it  s  not  like  your  gonna  make  it  out  alive    so  enjoy  the  short  time  you  have      joker,504,0.16666666666666669,1,take life seriously like gon na make alive enjoy short time joker
MwpMEbgC7DA,Ugjo2NcZatTdo3gCoAEC,promise  me  this  is  for  ever        i'm  crying,1744,-0.2,0,promise ever 'm crying
MwpMEbgC7DA,UgwNQ7HoxPrggUFsLSZ4AaABAg,this  song  pretty  much  means    for  those  of  you  who  aren  t  sure    going  into  a  new  relationship  wanting  to  start  over  and  wanting  to  love  the  person  but  carrying  baggage  and  pain  from  the  last  relationship,247,0.2643939393939394,1,song pretty much means sure going new relationship wanting start wanting love person carrying baggage pain last relationship
MwpMEbgC7DA,UgwCE_ZgeolKW7eKYcN4AaABAg,idfc  what  people  think  but  this  is  the  best  sad  song  in  history,363,0.25,1,idfc people think best sad song history
MwpMEbgC7DA,UgxSjWh3MWlKg2x7qEN4AaABAg,2  months  till  2022  and  i'm  still  listining  to  this  song,65,0.0,0,2 months till 2022 'm still listining song
MwpMEbgC7DA,UgwJIjeHJeSqYP6hUwF4AaABAg,smart  man  once  said    when  you  are  happy  you  enjoy  the  melody  but  when  you  are  sad  you  understand  the  lyrics,110,0.2285714285714285,1,smart man said happy enjoy melody sad understand lyrics
MwpMEbgC7DA,UgxvrdlafWZE9913e7N4AaABAg,this  might  be  the  only  pop  song  i  like  xd  brings  me  right    back  to  my  childhood,0,0.09523809523809523,1,might pop song like xd brings right back childhood
MwpMEbgC7DA,UgwbcdRcx-33TLf2ERV4AaABAg,it's  november  let's  see  how  many  people            are  still  here,0,0.5,1,'s november let 's see many people still
MwpMEbgC7DA,UgxN3IKmDAPm6b6mAcN4AaABAg,i  just  remembered  this  song  after  a  break  up,1,0.0,0,remembered song break
MwpMEbgC7DA,UgwkF8cGlxdkRbjaj-x4AaABAg,i'm  22  and  i  never  heard  this  song  until  now    but  i  can  definitively  say  that  this  song  is  merely  perfect      ',201,1.0,1,'m 22 never heard song definitively say song merely perfect '
MwpMEbgC7DA,UgxZWaFpyGK7_ppxQoJ4AaABAg,i  love  this  song,1,0.5,1,love song
MwpMEbgC7DA,UgwhzYmA79YuknFM8UJ4AaABAg,this  song  will  forever  be  iconic,19,0.5,1,song forever iconic
MwpMEbgC7DA,UgxrO2qEWp162mOQAjF4AaABAg,such  a  perfect  song    deep  and  great,1,0.45,1,perfect song deep great
MwpMEbgC7DA,UgzwatmVk0Iu5BODdLF4AaABAg,omg  fell  this  so  deep,1,0.0,0,omg fell deep
MwpMEbgC7DA,UgySCgDr12xYSBi6_dt4AaABAg,this  song  is  crazy,1,-0.6,0,song crazy
MwpMEbgC7DA,UgzFdBSyYqdr3vSjs714AaABAg,this  song  gives  me  chills  every  time  i  listen  to  it  and  it  makes  me  want  cry,65,0.0,0,song gives chills every time listen makes want cry
MwpMEbgC7DA,UgzSUG9uxuy5nf8-7fZ4AaABAg,you  know  a  song  is  gold  when  the  comment  section  is  still  active    2,0,-0.13333333333333333,0,know song gold comment section still active 2
MwpMEbgC7DA,UgxD7-qO8CURg2a6vyd4AaABAg,one  of  my  favourite  songs,0,0.0,0,one favourite songs
MwpMEbgC7DA,UghBdx3npjdVzHgCoAEC,this  song  is  a  masterpiece  musically  and  lyrically    the  sense    the  feeling  it  conveys    the  inability  to  love  a  person  the  way  you'd  want    because  another  one  has  already  taken  the  most  of  you    you've  loved  another  already  too  much    clinged  cried    spent    the  drainage    too  strong  of  a  feeling    just        respect,3160,0.31904761904761897,1,song masterpiece musically lyrically sense feeling conveys inability love person way 'd want another one already taken 've loved another already much clinged cried spent drainage strong feeling respect
MwpMEbgC7DA,UgyoJJ0m_BgTxHAur8p4AaABAg,exactly    what  is  the  lyrics  of  the  song  trying  to  say,0,0.25,1,exactly lyrics song trying say
MwpMEbgC7DA,UgwccgisdyrhYI_7eSd4AaABAg,someone    british  singers  loses  their  british  accent  while  singing  tom  odell    hold  my  tears,1798,-0.1,0,someone british singers loses british accent singing tom odell hold tears
