Video ID,Comment ID,comments,Likes,polarity,pol_cat,stop_comments
4ZHwu0uut3k,UgwgFLJzQl2Xb6H6JXJ4AaABAg,mildred  u  always  gonna  be  on  my  heart,2,0.0,0,mildred u always gon na heart
4ZHwu0uut3k,Ugz5zT6PxwcHLrSOyMt4AaABAg,cara's  eyes  can  see  through  my  soul,7,0.0,0,cara 's eyes see soul
4ZHwu0uut3k,Ugymwo6Mcln4DNfb5OR4AaABAg,so  many  memories  linked  to  this  one  song    jesus  christ    time  really  does  fly  by,3,0.5,1,many memories linked one song jesus christ time really fly
4ZHwu0uut3k,UgxfKQBr-tVqP_x_HVV4AaABAg,amazing  song  really  makes  you  think,17,0.4,1,amazing song really makes think
4ZHwu0uut3k,UghGwO-9B4cWvHgCoAEC,this  song  and  the  lyrics  are  insane,4,-1.0,0,song lyrics insane
4ZHwu0uut3k,UgyAtEoanweJB4CwCt94AaABAg,rare  case  where  the  remix  is  better  than  the  original,1,0.39166666666666666,1,rare case remix better original
4ZHwu0uut3k,Ugwz0RWa5GHvJM80Qz14AaABAg,n  wanna  kiss  u  to  make  u  feel  alright      love  it,1,0.5,1,n wan na kiss u make u feel alright love
4ZHwu0uut3k,UgjwMa-1N-RYHXgCoAEC,i  totally  love  this  channel  its  amazing  how  many  beautiful  sounds  there  are  and  it  would  be  so  sad  if  i  couldnt  hear  them      so  thank  you  guys  from  thesoundyouneed    youre  awesome  d,7,0.4916666666666667,1,totally love channel amazing many beautiful sounds would sad couldnt hear thank guys thesoundyouneed youre awesome
4ZHwu0uut3k,Ugy-Resbeu6HCCuSoWR4AaABAg,beautiful  music  lovely  sub  your  channel  best  wishes  friend,0,0.7833333333333333,1,beautiful music lovely sub channel best wishes friend
4ZHwu0uut3k,Ugx1lJbbyrzoBPjX22Z4AaABAg,how  to  pronounce  it    uh  nuh  thuh  luvh,1,0.0,0,pronounce uh nuh thuh luvh
4ZHwu0uut3k,UgzfS6ZltFDKnJo7Zt54AaABAg,where  is  the  loooove,0,0.0,0,loooove
4ZHwu0uut3k,Ugx9r61X-6ud8pkqKu14AaABAg,this  is  beautiful,16,0.85,1,beautiful
4ZHwu0uut3k,UgxL0Nu73EJqYNg0NcJ4AaABAg,i  can  feel    yeah  i  can,0,0.0,0,feel yeah
4ZHwu0uut3k,Ugy4c2pxox1WpaXgEZx4AaABAg,nostalgia  is  the  best  and  worst  feeling  ever    3,2,0.0,0,nostalgia best worst feeling ever 3
4ZHwu0uut3k,UgxbloiGXxzNkg9YWvl4AaABAg,it  remains  me  when  i  was  younger  i  was  playing  this  song  all  day,1,0.0,0,remains younger playing song day
4ZHwu0uut3k,UgyiZ6LCk469GeI32v14AaABAg,actually  the  sound  i  need    2013    to    2021,2,0.2,1,actually sound need 2013 2021
4ZHwu0uut3k,UgyPcdYl-9fn309TS814AaABAg,this  song  carries  so  many  emotions,2,0.5,1,song carries many emotions
4ZHwu0uut3k,Ugx9U7ESDFVEueTbtLh4AaABAg,hearing  this  i  just  want  to  ride  my  bike  ahead  and  forget  about  everything,3,0.0,0,hearing want ride bike ahead forget everything
4ZHwu0uut3k,UgwvjBvCcTxckSr9FOp4AaABAg,who  else  needs  to  listen  to  this  every  year  as  the  leaves  begin  to  change  color  and  the  weather  gets  colder  while  walking  through  a  park  alone    thinking  about  another  summer  gone,2,0.0,0,else needs listen every year leaves begin change color weather gets colder walking park alone thinking another summer gone
4ZHwu0uut3k,Ugybee8BP-8Om1ZMfA94AaABAg,feel  this  to  my  very  core,1,0.2,1,feel core
4ZHwu0uut3k,Ugx09U9qJdYIBTc13IJ4AaABAg,this  song  has  stayed  with  me      i  cannot  explain  it  but  whenever  i'm  feeling  lonely  or  like  i  just  need  a  drive  this  is  my  go  to  song,64,-0.09999999999999998,0,song stayed explain whenever 'm feeling lonely like need drive go song
4ZHwu0uut3k,UghV7S-0bQ4boXgCoAEC,lyrics        wanna  take  you  somewhere  so  you  know  i  care  but  it's  so  cold  and  i  don't  know  where  i  brought  you  daffodils  in  a  pretty  string  but  they  won't  flower  like  they  did  last  spring    and  i  wanna  kiss  you    make  you  feel  alright  i'm  just  so  tired  to  share  my  nights  i  wanna  cry  and  i  wanna  love  but  all  my  tears  have  been  used  up    on  another  love    another  love  all  my  tears  have  been  used  up  on  another  love    another  love  all  my  tears  have  been  used  up  on  another  love    another  love  all  my  tears  have  been  used  up    and  if  somebody  hurts  you    i  wanna  fight  but  my  hands  been  broken    once  too  many  times  so  i'll  use  my  voice    i'll  be  so  fucking  rude  words  they  always  win    but  i  know  i'll  lose    and  i'd  sing  a  song    that'd  be  just  ours  but  i  sang  'em  all  to  another  heart  and  i  wanna  cry  i  wanna  learn  to  love  but  all  my  tears  have  been  used  up    on  another  love    another  love  all  my  tears  have  been  used  up  on  another  love    another  love  all  my  tears  have  been  used  up  on  another  love    another  love  all  my  tears  have  been  used  up    i  wanna  sing  a  song    that'd  be  just  ours  but  i  sang  'em  all  to  another  heart  and  i  wanna  cry    i  wanna  fall  in  love  but  all  my  tears  have  been  used  up    on  another  love    another  love  all  my  tears  have  been  used  up  on  another  love    another  love  all  my  tears  have  been  used  up  on  another  love    another  love  all  my  tears  have  been  used  up,46,0.356896551724138,1,lyrics wan na take somewhere know care 's cold n't know brought daffodils pretty string wo n't flower like last spring wan na kiss make feel alright 'm tired share nights wan na cry wan na love tears used another love another love tears used another love another love tears used another love another love tears used somebody hurts wan na fight hands broken many times 'll use voice 'll fucking rude words always win know 'll lose 'd sing song 'd sang 'em another heart wan na cry wan na learn love tears used another love another love tears used another love another love tears used another love another love tears used wan na sing song 'd sang 'em another heart wan na cry wan na fall love tears used another love another love tears used another love another love tears used another love another love tears used
4ZHwu0uut3k,UgzzMqfZquPxHfGCjet4AaABAg,may  6  2013        oct  16  2021  best  remix    3  until  now,2,1.0,1,may 6 2013 oct 16 2021 best remix 3
4ZHwu0uut3k,Ugwv3gog6BxnyPy2EOp4AaABAg,i  remember  finding  this  song      right  before  finding  out  my  boyfriend  was  cheating  on  me          i  left  of  course        but  i  gave  him  my,1,0.14285714285714285,1,remember finding song right finding boyfriend cheating left course gave
4ZHwu0uut3k,UgyC4Ol7HnaNC5_p2cN4AaABAg,gona  down  load  this  love  the  best,0,0.4481481481481482,1,gona load love best
4ZHwu0uut3k,Ugzc23lHlYEwU_XoXZh4AaABAg,all  i  can  think  of  is  delena,0,0.0,0,think delena
4ZHwu0uut3k,Ugx0IsPkIeM7ByoJJCx4AaABAg,the  timeless    it  is  the  kind  of  song  you  associate  with  a  friend  that  was  with  you  along  the  years    made  you  feel  allright,6,0.6,1,timeless kind song associate friend along years made feel allright
4ZHwu0uut3k,Ugw9JyuW2PjcnKX2N7B4AaABAg,i  m  here  for  cara,0,0.0,0,cara
4ZHwu0uut3k,UgxtFNkn3fcQSUkSX3B4AaABAg,when  i  was  young    i  was  mad  for  a  man  and  would  love    kiss    cry    go  to  any  extent  and  get  hurt      still  not  stop  loving  him      when  i  thought  that  this  would  end  my  life    then  came  another  man    another  love    after  15  years    when  all  my  tears  were  used  up,3,0.215,1,young mad man would love kiss cry go extent get hurt still stop loving thought would end life came another man another love 15 years tears used
4ZHwu0uut3k,UgzByokH4JuKwwUMuph4AaABAg,good  music  play  withe  is  good  i  dont  know  i  lisen  what  happen  that  all,0,0.7,1,good music play withe good dont know lisen happen
4ZHwu0uut3k,UgwS3_zhX9q5XjpgppZ4AaABAg,i  wanna  take  you  somewhere  so  you  know  i  care  but  it's  so  cold  and  i  don't  know  where  i  brought  you  daffodils  in  a  pretty  string  but  they  won't  flower  like  they  did  last  spring  and  i  wanna  kiss  you    make  you  feel  alright  i'm  just  so  tired  to  share  my  nights  i  wanna  cry  and  i  wanna  love  but  all  my  tears  have  been  used  up  on  another  love    another  love  all  my  tears  have  been  used  up  on  another  love    another  love  all  my  tears  have  been  used  up  on  another  love    another  love  all  my  tears  have  been  used  up  oh  oh    oh  oh  oh  oh  oh  oh  oh  oh  oh  oh  oh  oh  and  if  somebody  hurts  you    i  wanna  fight  but  my  hand's  been  broken    one  too  many  times  so  i'll  use  my  voice    i'll  be  so  fucking  rude  words  they  always  win    but  i  know  i'll  lose  and  i'd  sing  a  song    that'd  be  just  ours  but  i  sang  'em  all  to  another  heart  and  i  wanna  cry    i  wanna  learn  to  love  but  all  my  tears  have  been  used  up  on  another  love    another  love  all  my  tears  have  been  used  up  on  another  love    another  love  all  my  tears  have  been  used  up  on  another  love    another  love  all  my  tears  have  been  used  up  oh  oh  i  wanna  sing  a  song    that'd  be  just  ours  but  i  sang  'em  all  to  another  heart  and  i  wanna  cry    i  wanna  fall  in  love  but  all  my  tears  have  been  used  up  on  another  love    another  love  all  my  tears  have  been  used  up  on  another  love    another  love  all  my  tears  have  been  used  up,8,0.3462962962962963,1,wan na take somewhere know care 's cold n't know brought daffodils pretty string wo n't flower like last spring wan na kiss make feel alright 'm tired share nights wan na cry wan na love tears used another love another love tears used another love another love tears used another love another love tears used oh oh oh oh oh oh oh oh oh oh oh oh oh oh somebody hurts wan na fight hand 's broken one many times 'll use voice 'll fucking rude words always win know 'll lose 'd sing song 'd sang 'em another heart wan na cry wan na learn love tears used another love another love tears used another love another love tears used another love another love tears used oh oh wan na sing song 'd sang 'em another heart wan na cry wan na fall love tears used another love another love tears used another love another love tears used
4ZHwu0uut3k,UgzCR85tNoppygPXP594AaABAg,this  song  is  my  end  of  mani  process,1,0.0,0,song end mani process
4ZHwu0uut3k,UgwFT0WCp41_zuIfJDF4AaABAg,was  this  really  seven  years  ago    damn          3,1,0.2,1,really seven years ago damn 3
4ZHwu0uut3k,UgyV2TxmcFeajz26pJx4AaABAg,well  another  friday  night  and  a  blessed  relief  from  work  and  oh  my  word    don't  we  just  love  this  lovely  riff,8,0.5,1,well another friday night blessed relief work oh word n't love lovely riff
4ZHwu0uut3k,UgykgUgsTbhKrbd9udV4AaABAg,this  can  make  me  feel  hurt  and  want  to  cry  even  if  everything  goes  perfect,92,1.0,1,make feel hurt want cry even everything goes perfect
4ZHwu0uut3k,Ugy_0DXdiziuT8wXlkp4AaABAg,since  the  beginning  i  knew  it  was  magnifique,1,0.0,0,since beginning knew magnifique
4ZHwu0uut3k,Ugyio6Aq28hN375ZUQN4AaABAg,so  you  really  waste  1  min  for  intro  lmao,0,0.2,1,really waste 1 min intro lmao
4ZHwu0uut3k,UgyScLL8xomXipz_l-14AaABAg,the  memory  of  this  song  is  still  in  my  mind      hat  ralar  eskimez      july    agust  2014,2,0.0,0,memory song still mind hat ralar eskimez july agust 2014
4ZHwu0uut3k,UgymZFkQiwO4HdzVyTt4AaABAg,who's  the  girl  on  the  image,0,0.0,0,'s girl image
4ZHwu0uut3k,UgwIXG_1jV8ENFEzzgR4AaABAg,what  a  banger,0,0.0,0,banger
4ZHwu0uut3k,Ugw2h2Mqf_rqOEYwPsV4AaABAg,my  first  vietnamese  friend  showed  me  this    good  music  touches  all  and  connects  humanity,30,0.475,1,first vietnamese friend showed good music touches connects humanity
4ZHwu0uut3k,UgyAtLxflk5NfXDsXjF4AaABAg,makes  me  sad  about  relationships  ive  never  had,0,-0.5,0,makes sad relationships ive never
4ZHwu0uut3k,Ugz01tObLwh7HL-G2Mx4AaABAg,nostalgic    mellow  cool    rithmic  for  a  good  wining,16,0.18333333333333326,1,nostalgic mellow cool rithmic good wining
4ZHwu0uut3k,Ugz3ar24cv2yaaZiPrB4AaABAg,i  will  always  come  back  to  this  one,1,0.0,0,always come back one
4ZHwu0uut3k,UgybmzCSotVnu7vL1MB4AaABAg,2013  brought  me  here,0,0.0,0,2013 brought
4ZHwu0uut3k,UgyBFa6UL4CtnMjCktF4AaABAg,7  yrs  later  i  still  suprised  how  fast  time  flies,12,0.1,1,7 yrs later still suprised fast time flies
4ZHwu0uut3k,Ugixs4tFpdpN5XgCoAEC,the  song  you  listen  to  on  a  rainy  day  when  almost  all  hope  is  lost    almost,89,0.0,0,song listen rainy day almost hope lost almost
4ZHwu0uut3k,UghMYl7TEOzY-3gCoAEC,how  could  cara  delevingne  stay  and  stare  at  the  camera  for  6  minutes  without  any  move,2029,0.0,0,could cara delevingne stay stare camera 6 minutes without move
4ZHwu0uut3k,Ugyx1P0Af3wfEFJrTL14AaABAg,the  first  minute  of  this  beat  is  an  absolute  masterpiece,27,0.225,1,first minute beat absolute masterpiece
4ZHwu0uut3k,Ugia2HC7rCfxx3gCoAEC,superb  mix  but  nothing  beats  the  original  version    3,3,0.6875,1,superb mix nothing beats original version 3
4ZHwu0uut3k,UgxuYgSI4hriF8ZRGp94AaABAg,what  a  time  man  wow,0,0.1,1,time man wow
4ZHwu0uut3k,Ugzn2d-P3yrTesU98PB4AaABAg,my  girlfriend  just  left  me  for  another  guy,0,0.0,0,girlfriend left another guy
4ZHwu0uut3k,UgxaQsErOHapjMek4Ft4AaABAg,im  from  poland    when  i  play  this  song  i  feel  amazing  i  love  it,9,0.55,1,im poland play song feel amazing love
4ZHwu0uut3k,Ugie5WwZVyn1G3gCoAEC,once  you  playing  this  song  cant  resist  to  replay  99999  time,17,0.0,0,playing song cant resist replay 99999 time
4ZHwu0uut3k,UgwV_sXTv5UctQR2N0Z4AaABAg,this  girl  is  from  paper  towns  i  finally  remembered,1,0.0,0,girl paper towns finally remembered
4ZHwu0uut3k,Ugx2_Sj9OmyJg4DZ4gp4AaABAg,2021  who's  listening,3,0.0,0,2021 's listening
4ZHwu0uut3k,UgyGWK7Qtm2nZHGLWRl4AaABAg,stoned    goosebumps,1,0.0,0,stoned goosebumps
4ZHwu0uut3k,UgzZq-WkXjURqz-m22F4AaABAg,the  sound  i  need    when  filled  with  fury  this  gives  me  peace    i  am  a  patient  man    fury  is  filled  by  demons  that  torment  me    this  is  the  sound  i  need,0,0.4,1,sound need filled fury gives peace patient man fury filled demons torment sound need
4ZHwu0uut3k,UgwSZoe4xn-jEK9piDV4AaABAg,i  wanna  take  you  somewhere  so  you  know  i  care  but  it's  so  cold  and  i  don't  know  where  i  brought  you  daffodils  in  a  pretty  string  but  they  won't  flower  like  they  did  last  spring  and  i  wanna  kiss  you    make  you  feel  all  right  i'm  just  so  tired  to  share  my  nights  i  wanna  cry  and  i  wanna  love  but  all  my  tears  have  been  used  up      chorus    on  another  love    another  love  all  my  tears  have  been  used  up  on  another  love    another  love  all  my  tears  have  been  used  up  on  another  love    another  love  all  my  tears  have  been  used  up    up      verse  2    and  if  somebody  hurts  you    i  wanna  fight  but  my  hands  been  broken  once    too  many  times  so  i'll  use  my  voice    i'll  be  so  fucking  rude  words    they  always  win    but  i  know  i'll  lose  and  i'd  sing  a  song  that'd  be  just  ours  but  i  sang  'em  all  to  another  heart  and  i  wanna  cry    i  wanna  learn  to  love  but  all  my  tears  have  been  used  up,0,0.24327731092436974,1,wan na take somewhere know care 's cold n't know brought daffodils pretty string wo n't flower like last spring wan na kiss make feel right 'm tired share nights wan na cry wan na love tears used chorus another love another love tears used another love another love tears used another love another love tears used verse 2 somebody hurts wan na fight hands broken many times 'll use voice 'll fucking rude words always win know 'll lose 'd sing song 'd sang 'em another heart wan na cry wan na learn love tears used
4ZHwu0uut3k,UgwE1dkG9Yy8dOlF0QZ4AaABAg,this  is  soo  2000s,1,0.0,0,soo 2000s
4ZHwu0uut3k,UgyvwGB3DfdYw7jJnGl4AaABAg,that  anxiety  you  feel  when  you  ve  lost  someone    whether  it  was  a  friend  or  a  family  member        that  anxiety  when  you  wish  you  could  ve  taken  their  hands  for  one  last  time  and  then  said  goodbye        only  to  realize  that  you  couldn  t  and  now  you  have  to  live  with  that  thought  hunting  you    while  you  ask  yourself  if  that  anxiety  would  go  away  if  things  had  ended  up  differently,5,0.03409090909090909,1,anxiety feel lost someone whether friend family member anxiety wish could taken hands one last time said goodbye realize live thought hunting ask anxiety would go away things ended differently
4ZHwu0uut3k,UgyzDCqxhu0PBqjD7Xx4AaABAg,who  is  here  before  the  kiss  with  elena  and  damon    tvd,1,0.0,0,kiss elena damon tvd
4ZHwu0uut3k,Ugw-yGbcrx9joy1aFe94AaABAg,good  sound,1,0.55,1,good sound
4ZHwu0uut3k,UgzJlxGDwGJExSL_akR4AaABAg,10  years  with  my  first  love  and  ive  never  cheated  on  her    have  a  great  day  people,20,0.5166666666666667,1,10 years first love ive never cheated great day people
4ZHwu0uut3k,Ugwoi-lPolR8fcYhn8l4AaABAg,i  love  the  music        3,1,0.5,1,love music 3
4ZHwu0uut3k,UgzH0zehO6SLWuP8PyZ4AaABAg,i  made  a  mix  with  my  fork  and  spoon  ticking  on  my  diner  table  and  got  half  a  billion  views,0,-0.16666666666666666,0,made mix fork spoon ticking diner table got half billion views
4ZHwu0uut3k,UgxjwfOIM27WeicpAr14AaABAg,anyone  still  here,0,0.0,0,anyone still
4ZHwu0uut3k,UgznR3M1YnRjll6DoeJ4AaABAg,hey    stranger  i  hope    u  have  a  great  day  ahead  fr  u              jst  remember  you  will  hit  many  bumps  along  the  way      bt  u'll  keep  moving  on  that's  wht  matters  most        enjoy  ur  moments,1,0.55,1,hey stranger hope u great day ahead fr u jst remember hit many bumps along way bt u 'll keep moving 's wht matters enjoy ur moments
4ZHwu0uut3k,UgwBAaHScoCldzfFA2l4AaABAg,2020  best  believe  my  kids  are  going  to  know  this  song      thank  you  odell,16,1.0,1,2020 best believe kids going know song thank odell
4ZHwu0uut3k,Ugyo49_JRAOK6eJPACx4AaABAg,19  years  now  26  wauuu  feeling,0,0.0,0,19 years 26 wauuu feeling
4ZHwu0uut3k,UgwHdLXYbS82kcEdXSJ4AaABAg,you  know  you  are  in  love  when  she  is  more  beautiful  in  concrete  reality  than  in  your  imagination        me  5  seconds  ago,3,0.5,1,know love beautiful concrete reality imagination 5 seconds ago
4ZHwu0uut3k,UgzMoggcRix_B4uZ2QJ4AaABAg,the  best  song  ever,0,1.0,1,best song ever
4ZHwu0uut3k,Ugyd3T9Nd5k300oUu194AaABAg,this  song  is  showing  its  age                        but  i  think  that's  kind  of  a  good  thing,0,0.6499999999999999,1,song showing age think 's kind good thing
4ZHwu0uut3k,Ugy1jozA5_mTaVwCwqd4AaABAg,when  the  edit  has  more  views  than  the  original  music  video,0,0.4375,1,edit views original music video
4ZHwu0uut3k,Ugy9ucZNZI2Gi3rKMLp4AaABAg,perfect,1,1.0,1,perfect
4ZHwu0uut3k,Ugzz_p6KCmNfjcQW-El4AaABAg,im  here  for  buisiness,0,0.0,0,im buisiness
4ZHwu0uut3k,UgwURxslvT5AX7YILAN4AaABAg,cara  is  my  crush,2,0.0,0,cara crush
4ZHwu0uut3k,Ugi0Xg_x-KEho3gCoAEC,this  is  epic    i  love  it,3,0.3,1,epic love
4ZHwu0uut3k,Ugztkd26PMa8NXgUSfp4AaABAg,who  is  with  me  in  june  2020,688,0.0,0,june 2020
4ZHwu0uut3k,Ugho_tX1hxErIngCoAEC,why  can't  all  mixes  and  edits  be  like  this    gentle  and  respecfull  to  the  original  song    preserving  all  the  emotion  and  building  upon  it,540,0.2875,1,ca n't mixes edits like gentle respecfull original song preserving emotion building upon
4ZHwu0uut3k,UgwqSxW-N2cS7AI9Pd94AaABAg,im  crying  right  now,0,0.04285714285714285,1,im crying right
4ZHwu0uut3k,UgyC6Qw-XuOwfRM5kDZ4AaABAg,love  this  song    top  of  my  playlist    i  haven't  played  piano  since  i  was  about  13  and  i'm  at  uni  now  and  i  love  the  piano  instrumental  so  much  i'm  starting  to  learn  it,18,0.375,1,love song top playlist n't played piano since 13 'm uni love piano instrumental much 'm starting learn
4ZHwu0uut3k,UgyO-fR-xM9MYEuTKCd4AaABAg,re  liking  this  so  it's  at  the  top  of  my  liked  videos,1,0.55,1,liking 's top liked videos
4ZHwu0uut3k,Ugw452vdFbH3cbgONPt4AaABAg,i  like  the  picture,0,0.0,0,like picture
4ZHwu0uut3k,UgwGdYO3MXnJTuktN6R4AaABAg,keep  coming  back    great  song    even  better  for  the  mix    stay  safe,0,0.45,1,keep coming back great song even better mix stay safe
4ZHwu0uut3k,Ugjo2AFskKSzKHgCoAEC,this    on  repeat    when  coming  down,4,-0.1555555555555556,0,repeat coming
4ZHwu0uut3k,UgxGOSxe8HHXDi8fHZx4AaABAg,7  years        still  hits  different,0,0.0,0,7 years still hits different
4ZHwu0uut3k,UgyV0D66XF0fhxv-ZcR4AaABAg,following  me    the  deepest  downs        but  and  when  up      delivers  still      someone  just        made  it  listenable    again  and  again,0,0.0,0,following deepest downs delivers still someone made listenable
4ZHwu0uut3k,UgzLDFMoOKiw66HN7mR4AaABAg,this  tune,2,0.0,0,tune
4ZHwu0uut3k,UgzUdOUk5ehBiBbr2Od4AaABAg,i  just  saw  life  in  a  year  and  first  vid  i  see  is  this,0,0.25,1,saw life year first vid see
4ZHwu0uut3k,UgzVXEXrxrpz5XCX9wZ4AaABAg,when  people  ask  what  is  perfection  i  direct  them  here,3,0.1,1,people ask perfection direct
4ZHwu0uut3k,UgibIY0NsJsRv3gCoAEC,i  listened  this  3  years  ago  and  it  was  just  beutiful  song    but  only  now  i  tryied  to  listen  to  this  song's  lyrics  and  i  understood  that  this  song  is  much  more  beutiful  than  i  thought,3,0.25,1,listened 3 years ago beutiful song tryied listen song 's lyrics understood song much beutiful thought
4ZHwu0uut3k,UgwkQ8hPUbHpPXQj3WN4AaABAg,why  does  this  have  so  many  views  compared  to  the  original,0,0.4375,1,many views compared original
4ZHwu0uut3k,UgysUL9GOtBy_HvrdYp4AaABAg,this  song  reminds  me  of  my  ex    she  used  to  play  it  in  her  car  all  the  time    good  by  once  upon  a  time,18,0.7,1,song reminds ex used play car time good upon time
4ZHwu0uut3k,UgySa7eZMnoxSc_cInt4AaABAg,is  that  a  zac  effron,0,0.0,0,zac effron
4ZHwu0uut3k,UgzzeCX4Pm87S2vmdY14AaABAg,perfectly  done,0,1.0,1,perfectly done
4ZHwu0uut3k,UgwQXM5m8H5sI2ckA9p4AaABAg,soo  crazy    from  istanbul,0,-0.6,0,soo crazy istanbul
4ZHwu0uut3k,Ugy0Ju9aqWucgH1yYdF4AaABAg,is  that  cara  delevingne      3  btw  still  listening  this  one,0,0.0,0,cara delevingne 3 btw still listening one
4ZHwu0uut3k,UgyNK4-qkVz3u1ZAVt14AaABAg,i  wich  baking  10  years  go,0,0.0,0,wich baking 10 years go
4ZHwu0uut3k,UgxPgFCBCr3WlUv2w894AaABAg,amour  are  you  ready  what  is  love  listen  to  your  heart,0,0.35,1,amour ready love listen heart
4ZHwu0uut3k,Ugz7puBnqW7Q5-HlKRd4AaABAg,2021  and  i  look  for  another  love,0,0.5,1,2021 look another love
4ZHwu0uut3k,Ugz9NnnRNtRjeGI4MdR4AaABAg,esus  christ  is  the  way    the  truth    the  life    no  one  comes  to  the  father  except  through  him    there  is  no  other  intermediary    may  jesus  bless  you    trust  him    give  your  life      and  he  will  take  care  of  it    pray  convert  yourself  and  believe  in  the  gospel,1,0.0625,1,esus christ way truth life one comes father except intermediary may jesus bless trust give life take care pray convert believe gospel
4ZHwu0uut3k,UgwIKUCLcODa1Fzqda54AaABAg,only  come  across  this  song  today    can  t  stop  listening  to  it      absolutely  amazing,4,0.30000000000000004,1,come across song today stop listening absolutely amazing
4ZHwu0uut3k,UgxOFaM4nB0wnq1F0Sp4AaABAg,it  hurts  me  that  this  is  on  tiktok  now    before  you  say  anything      yes  im  gatekeeping  but  because  i  dont  want  its  importance  and  meaning  to  get  deteriorated  for  a  measley  trend    this  song  means  too  much  to  me  for  that,2,0.2,1,hurts tiktok say anything yes im gatekeeping dont want importance meaning get deteriorated measley trend song means much
4ZHwu0uut3k,Ugxxs5H13m3oZVslHxF4AaABAg,this  is  brilliant,0,0.9,1,brilliant
4ZHwu0uut3k,UgxMqf67VC4gnOwipFd4AaABAg,half  a  billion  views  wow    i  never  knew  this  got  that  big,0,-0.022222222222222216,0,half billion views wow never knew got big
4ZHwu0uut3k,Ugz2XpseU4aua2vfrX94AaABAg,this  song  makes  me  feel  thinking  about  memories  i  don't  even  have,1,0.0,0,song makes feel thinking memories n't even
4ZHwu0uut3k,UgzjfWrSpjk8DHBP-8V4AaABAg,this  remix  made  more  views  then  the  original  one      damn,5,0.4375,1,remix made views original one damn
4ZHwu0uut3k,UgxWQKAkyZLujbpMODR4AaABAg,one  of  the  best  song  ever,2,1.0,1,one best song ever
4ZHwu0uut3k,UgwLcohL3j71NVUn1pZ4AaABAg,so  relaxing    best  music,1,1.0,1,relaxing best music
4ZHwu0uut3k,UgxTeAgYigmozFA-AUR4AaABAg,that  is  just  what  i  realy  needed    thx  for  that,70,0.0,0,realy needed thx
4ZHwu0uut3k,Ugzb_Rv130czayJC2lJ4AaABAg,jeez  it  s  been  forever  anyone  here  sept  1st  2020,3,0.0,0,jeez forever anyone sept 1st 2020
4ZHwu0uut3k,UgzZujaMn6eJOaOQGH14AaABAg,i  remember  finding  this  song  when  i  was  14    i  showed  it  to  my  dad  and  it  became  his  favorite  song  for  a  while    we  used  to  listen  to  it  together  a  lot    now  it  has  been  a  year  ago  since  he  passed  away  and  i  just  found  this  again    breaks  my  heart  but  also  brings  up  so  many  beautiful  memories  with  him,423,0.6166666666666667,1,remember finding song 14 showed dad became favorite song used listen together lot year ago since passed away found breaks heart also brings many beautiful memories
4ZHwu0uut3k,UgxU0dqqxEOOTffSFIp4AaABAg,one  of  those  songs  that  simply  never  gets  old,23,0.05,1,one songs simply never gets old
4ZHwu0uut3k,Ugwkt-xPTunt31X3SFB4AaABAg,just  recently  realized  that  2015  summer  was  the  best  time  in  my  life  so  far    and  passed  with  this  songs    really  feel  emotional  listening  and  remembering  all  of  this,58,0.26,1,recently realized 2015 summer best time life far passed songs really feel emotional listening remembering
