Video ID,Comment ID,comments,Likes
4ZHwu0uut3k,UgxsCOBIAEkkd2DyKH14AaABAg,Would  ve  liked  the  clapping  to  be  more  complex    This  repetitive  song  expresses  so  much  complex  emotion    it  deserves  a  complex  beat  ,3
4ZHwu0uut3k,Ugh6TAeXX5INWHgCoAEC,Cara  is  perfect    Song  is  perfect    My  friends    this  is  a  perfect  upload  ,5
4ZHwu0uut3k,UgylLWAeKytOmNonlNx4AaABAg,2  0  2  1  B  R  A  S  I  L,5
4ZHwu0uut3k,UgwD8X-6hPwobSGqB6p4AaABAg,the  nice  woman,0
4ZHwu0uut3k,UgyTuvoFx39j3VfbbPp4AaABAg,shes  hot,0
4ZHwu0uut3k,Ugwk9XDAVzf3YJ7HXxx4AaABAg,If  you  are  still  listening  to  this  you  are  a  certified  legend    3,6
4ZHwu0uut3k,UgyQDcxGRLlipsZpfph4AaABAg,Why  are  this  songs  not  popular  but  those  shitti  songs  are    i  am  listening  to  this  nostalgia  from  past  3  yeah  and  this  never  gets  old  ,0
4ZHwu0uut3k,UgxkhksuAJxcJQj2aVV4AaABAg,hauntingly  beautiful,0
4ZHwu0uut3k,Ugx4FKYwLnN4BbjiW1N4AaABAg,Lockdown  2021  anyone  ,1
4ZHwu0uut3k,Ugxo7FgqztrgeAK3RZl4AaABAg,My  friend  played  this  song  when  i  was  high  on  LSD  and  it  was  the  best  moment  of  my  life  watching  the  sky  this  song  was  the  soundtrack  of  my  life  it  calms  me  down  more  than    u  can  imagine      thaaaaanks    ,385
4ZHwu0uut3k,UgyrldW75uqsMwKDscR4AaABAg,I  was  pumping  this  tune  years  ago  and  to  see  half  a  billion  views  makes  me  proud  ,21
4ZHwu0uut3k,Ugi-MfPPNPoKqHgCoAEC,This  song  is  fantastic,9
4ZHwu0uut3k,UgwQX9TSddamzHC4Prx4AaABAg,Ok  can  someone  tell  me  is  the  girl  featured  here  Cara    ,0
4ZHwu0uut3k,UgxdNOy1S44Cyocg7Ux4AaABAg,Thank  you    beautiful  child    I  did  need  this  sound  at  this  moment  in  time    ,87
4ZHwu0uut3k,UggzofcGh_TCkXgCoAEC,love  this        listening  everyday          3    SLOVAKIA,29
4ZHwu0uut3k,UgzN8AWpbAribEP8OTZ4AaABAg,Who's  here  in  2021,0
4ZHwu0uut3k,UgjW-RmTKIvA5HgCoAEC,D    Here  are  some  new  Deep  H  tracks    1    George  FitzGerald      Bad  Aura    Original  Mix    2    Adam  Beyer    Ida  Engberg      You  Know    Original  Mix    3    Magnus  Wedberg  feat    Sushei      Sway  My  Way    Original  Mix    4  Sonny  Fodera  feat    Amber  Jolene      Hold  It  Down    Original  Mix    5    Khatapillah      Rest  High    Original  Mix    6    Manuel  Luna      Midnight  Thang    JTWild  Deep  Remix    7    Danver      Mixmaz    Original  Mix    8    Ricardo  Mejia      I  Need  You    Original  Mix          ENJOY      ,27
4ZHwu0uut3k,UgyWXCUvZ4ZMK0MlXYZ4AaABAg,whats  the  name  of  the  girl  on  the  picture        ,0
4ZHwu0uut3k,Ugyy6P4L0aw8vMQ-rkp4AaABAg,Who  is  the  girl  in  the  image  ,0
4ZHwu0uut3k,UgySxL4nSye7XCbGDWt4AaABAg,i  wanna  cry  and  i  wanna  love  what  the  beautiful  song  ,7
4ZHwu0uut3k,Ugxa3GTxWQ91EPYZGH54AaABAg,THERE  ARE    IN  YOUR  COMPUTERS  PLEASE  BLIEVE,0
4ZHwu0uut3k,UgyV2TxmcFeajz26pJx4AaABAg,Well  another  Friday  night  and  a  blessed  relief  from  work  and  oh  my  word    don't  we  just  love  this  lovely  riff              ,8
4ZHwu0uut3k,UgwK1NdxTqI-AldZ0Dh4AaABAg,Whats  the  name  of  the  girl  ,1
4ZHwu0uut3k,UgzByokH4JuKwwUMuph4AaABAg,Good  music  play  withe  is  good  i  dont  know  i  lisen  what  happen  that  all,0
4ZHwu0uut3k,Ugw3rjCrvvmGwbSFULV4AaABAg,Im  soooo  obsessed  with  thiss    SONG  ,2
4ZHwu0uut3k,Ugybee8BP-8Om1ZMfA94AaABAg,Feel  this  to  my  very  core    ,1
4ZHwu0uut3k,UgyC8OO2zohvqu19nPN4AaABAg,Very  beautiful        I  love  this  music  ,1
4ZHwu0uut3k,Ugw71BBFSZHB6ImxSiV4AaABAg,Great  track    brings  back  the  memories  of  younger  days,1
4ZHwu0uut3k,UgzUTA1HaTsxle2qH2Z4AaABAg,Love  this  song  ,0
4ZHwu0uut3k,UghGwO-9B4cWvHgCoAEC,This  song  and  the  lyrics  are  insane  ,4
4ZHwu0uut3k,UgwfqrPgSoyZ75dvvXd4AaABAg,Its  very  weird  for  me    i  remember  the    day  you  posted  this  song  and  from  that  day  i'm  a  big  fan  of  your  channel  and  it  can't  get  out  of  my  head  for  seven  years  big  up  for  you  ,4
4ZHwu0uut3k,UgwfV2NILEYg83Y_mUh4AaABAg,still  one  of  the  best        3,0
4ZHwu0uut3k,UgxHSqzuFunPmibklHN4AaABAg,I've  been  listening  to  this  song  since  I've  known  it  for  years    It's  fantastic  and  it's  never  boring    Sorry  for  my  band  English  Im  Argentinian    Cheers,2
4ZHwu0uut3k,UgzlkuVXOEShTd42xHN4AaABAg,I  was  here  when  this  had  60  M  views    I  see  Cara  Delevigne's  charm  is  still  working    Btw  song  is  awsome  too  ,1
4ZHwu0uut3k,UgyoBG7IkH0cCxlPNa94AaABAg,Happy  new  year  for  those  people  that  found  love  this  year  ,6
4ZHwu0uut3k,UgwcJUI1IluZHE1CPvl4AaABAg,2021  this  song  is  still  lit  ,1
4ZHwu0uut3k,Ugz6qTgVNlOPSHKEyjx4AaABAg,I  think  this  is  the  best  remix  I've  heard    Amazing  melody,4
4ZHwu0uut3k,Ugxyse9BlijW0o9xCSh4AaABAg,Original  Lyrics    I  wanna  take  you  somewhere  so  you  know  I  care  But  it's  so  cold  and  I  don't  know  where  I  brought  you  daffodils  in  a  pretty  string  But  they  won't  flower  like  they  did  last  spring  And  I  wanna  kiss  you    make  you  feel  alright  I'm  just  so  tired  to  share  my  nights  I  wanna  cry  and  I  wanna  love  But  all  my  tears  have  been  used  up  On  another  love    another  love  All  my  tears  have  been  used  up  On  another  love    another  love  All  my  tears  have  been  used  up  On  another  love    another  love  All  my  tears  have  been  used  up  Oh  oh    Oh  oh  oh  oh  oh  oh  Oh  oh  oh  oh  oh  oh  And  if  somebody  hurts  you    I  wanna  fight  But  my  hand's  been  broken    one  too  many  times  So  I'll  use  my  voice    I'll  be  so  fucking  rude  Words  they  always  win    but  I  know  I'll  lose  And  I'd  sing  a  song    that'd  be  just  ours  But  I  sang  'em  all  to  another  heart  And  I  wanna  cry    I  wanna  learn  to  love  But  all  my  tears  have  been  used  up  On  another  love    another  love  All  my  tears  have  been  used  up  On  another  love    another  love  All  my  tears  have  been  used  up  On  another  love    another  love  All  my  tears  have  been  used  up  Oh  oh  I  wanna  sing  a  song    that'd  be  just  ours  But  I  sang  'em  all  to  another  heart  And  I  wanna  cry    I  wanna  fall  in  love  But  all  my  tears  have  been  used  up  On  another  love    another  love  All  my  tears  have  been  used  up  On  another  love    another  love  All  my  tears  have  been  used  up  On  another  love    another  love  All  my  tears  have  been  used  up  oh  oh    oh,3
4ZHwu0uut3k,UgyqLVgaVnGyQjfE2HN4AaABAg,Songs  can  be  meaningful  and  sometimes  only  temporary    This  tune  right  now  at  the  end  of  2020  means  this  to  me    EVERYTHING,0
4ZHwu0uut3k,Ugwypjq4iNhNmMYb47d4AaABAg,just  found  this  song  Dec  2020  and  its  already  7  years  old,9
4ZHwu0uut3k,Ugg9RjzBJUkhhHgCoAEC,Something  I  can  really  chill  out  to    great  song    ,4
4ZHwu0uut3k,UgxEx840B42S1hPnxgh4AaABAg,omg      I  love  this  music        ,1
4ZHwu0uut3k,UgyK3KMsRT9T62z__ed4AaABAg,Came  here  in    2014  Again  in    2020  Its  2am  here  nd  this  wonderful  song  still  comforts  me,8
4ZHwu0uut3k,UgxYOY9nRO-RQL1xz454AaABAg,Happy  New  Year  to  everyone    May  you  all  have  everlasting  peace      ,3
4ZHwu0uut3k,UggZYH2DzjhHBXgCoAEC,I  love  this  one  soo  much  ,3
4ZHwu0uut3k,Ugx3gQEiL4gVfJwclLp4AaABAg,Everybody  talking  about  how  emotional  this  song  makes  them    and  I'm  just  over  here  vibing  cause  I  like  the  beat,25
4ZHwu0uut3k,UgyQDXTqcojPQfeONTl4AaABAg,Me  trying  to  sleep    My  Brain      HEY  REMEMBER  THIS  SONG  ,71
4ZHwu0uut3k,UgxGOSxe8HHXDi8fHZx4AaABAg,7  years        still  hits  different,0
4ZHwu0uut3k,UgxetzLCSy8nqvEjZwF4AaABAg,Listening  to  this  on  some  good  molly  makes  you  love  yourself  in  ways  i  can  t  explain,4
4ZHwu0uut3k,Ughgqch-iEMbn3gCoAEC,First  time  listening  to  this  was  when  I  was  siting  on  the  balcony  watching  the  sun  set  and  every  time  I  listen  to  this  song    memory  of  that  day  comes  alive        It's  amazing  how  music  can  wake  memories  we  thought  forgotten          3,3
4ZHwu0uut3k,Ugx1B05DeSrdsMJubWh4AaABAg,Such  a  memories  ,0
4ZHwu0uut3k,UgxAL27JN0IS0o6smZd4AaABAg,    Hey  dude    i's  2021  already      wanna  listen  your  music  everday      You    help  me  study  and    do    my    best      ,0
4ZHwu0uut3k,Ugyub1tuUU0YkqogRBh4AaABAg,Good  year    Bad  year    This  song  will  always  be  relevant,0
4ZHwu0uut3k,UgyiZ6LCk469GeI32v14AaABAg,Actually  the  sound  i  need    2013    To    2021,2
4ZHwu0uut3k,Ugz2mohFHKeyiciY4X94AaABAg,Still  ain't  no  better  song  to  fill  the  empty  nights,17
4ZHwu0uut3k,Ugzvz2Q4qeuLzgAQYz94AaABAg,this  song  is  my  grAVE,0
4ZHwu0uut3k,UgxjhQ-w08VnAS7Fc_B4AaABAg,I  dont  know  how  many  times  in  my  life  i  listened  it  and  it  still  as  beautifle  as  first  time  ,4
4ZHwu0uut3k,UgyyAg-ES20RL90jE2B4AaABAg,Superb    first  time  I  ve  heard,0
4ZHwu0uut3k,UgzD1Cz1XkGuSqnuOe14AaABAg,This  is  so  nice,0
4ZHwu0uut3k,Ugyr-a_m9kbbAzt8-mp4AaABAg,Wow    it  s  been  since  I  listened  to  this,1
4ZHwu0uut3k,Ugzw6s9xPQ_DI-4nVV94AaABAg,The  best  song  in  the  Universe  love  it    who's  watching  and  listening  at  these  in  November2020    Like,8
4ZHwu0uut3k,UgzMJ8dD2jYVlW1zO4Z4AaABAg,Wow  Deep    Loving  It  already    Yea    That  Goooooood  ,2
4ZHwu0uut3k,Ugwx3X9tQl6DROfkNbl4AaABAg,this  is  beautiful  paining,1
4ZHwu0uut3k,UgzvHcurmda_fRojIQN4AaABAg,I  want  to  cry  but  all  my  tears  have  been  used  up  ,1
4ZHwu0uut3k,UgzNwA5LeGfb2GrdvT94AaABAg,Close  your  eyes  this  song  takes  you  to  places  we  might  never  have  been  without  music  ,4
4ZHwu0uut3k,UgwXxygJlK2oMts6xi54AaABAg,life  is  so  beautiful      hope  you  enjoy  your  time  and  live  a  happy  life    Remember  your  time  is  limited      so  do  what  you  want  to  do      Do  it  now  and  don't  wait  for  the  perfect  moment    Greetings  from  Germany,8
4ZHwu0uut3k,UgxNSkt9gC-UGS185wZ4AaABAg,very  good  music      I  am  from  turkey    ,14
4ZHwu0uut3k,Ugwr2gMasCVcuGGrEnZ4AaABAg,This  song  i  fell  me  sad  and  happy,1
4ZHwu0uut3k,UgiB4jdd8pQGlHgCoAEC,They  played  this  song  last  night  at  the  Montreal  Nuit  Blanc  festival    Amazing  time  amazing  song  ,3
4ZHwu0uut3k,UgxhEFXVfC7_mAZ1RbJ4AaABAg,Y  love  this  song,0
4ZHwu0uut3k,Ugx4qgNEKEujLfxaho54AaABAg,All  I  can  do  is  just  reminisce  the  memories    Almost  5  years,2
4ZHwu0uut3k,UgywVEJG6iaDEC7GvVR4AaABAg,This  reminds  me  of  my  boyfriend              I  love  you  baby  forever  I  dnt  ever  want  to  loose  you  bByRR,1
4ZHwu0uut3k,Ugz4UxNXuBZNrg9vbDZ4AaABAg,Stop  asking  who  s  still  listening    we  never  stop  listening,34
4ZHwu0uut3k,UgzcWrlXtkEdV22IzAN4AaABAg,I  miss  those  days        ,1
4ZHwu0uut3k,UgwwFvIKaSE_fC3Mua94AaABAg,Mostly  H  S    ALL  TEARS  OF  YOX  WE  HAD  BIG  PLANS            ,0
4ZHwu0uut3k,UgxbloiGXxzNkg9YWvl4AaABAg,It  remains  me  when  i  was  younger  i  was  playing  this  song  all  day,1
4ZHwu0uut3k,Ugwx2ekbXHYLdRyxi8R4AaABAg,This  song  in  Spotify  ,1
4ZHwu0uut3k,UgxL0Nu73EJqYNg0NcJ4AaABAg,I  can  feel    yeah  I  can,0
4ZHwu0uut3k,Ugxx5B-Sh-mtg8T8lg14AaABAg,Did  someone  remember  how  often  people  asked  who  the  girl  is          that  old  times,35
4ZHwu0uut3k,UgyNzSELq_t0UJxtEhV4AaABAg,I  didn't  sign  a  permission  slip  for  this  feels  trip    ,11
4ZHwu0uut3k,UgwWKe3MZ2Lo5TrRJmx4AaABAg,I  LOVE  CARA  ON  THIS  PICTURE  ,0
4ZHwu0uut3k,Ugyp2st8cN-8GRdNoKp4AaABAg,2012    crying      2020    still  crying,4
4ZHwu0uut3k,Ugzqcfh6QxjmpsEokT54AaABAg,When  the  edit  has  more  views  than  the  original  song    Soooo  good,3
4ZHwu0uut3k,Ugz6icj_uizPs5B-H5Z4AaABAg,2020      crying  2021      and  just  cryingggggg,2
4ZHwu0uut3k,UgwnqU1LRfSWl8qLH_N4AaABAg,Dear  YouTube  recommendation  system    DO  NOT  EVER  FORGET  THIS  SONG    ,15
4ZHwu0uut3k,UgwEbnjxMgjSAWOh8H14AaABAg,Who  still  likes  it  in  2021        3,0
4ZHwu0uut3k,UgwQXM5m8H5sI2ckA9p4AaABAg,Soo  crazy    from  istanbul  ,0
4ZHwu0uut3k,UgyUTCLet0aUmvYzf9l4AaABAg,Miss  you  E  S  ,0
4ZHwu0uut3k,UgzRtVR84szU5tm-zFt4AaABAg,Know  i  remember  everything  about  my  life,16
4ZHwu0uut3k,UgwRT5BwLmVcjCqPtil4AaABAg,7  Years  later  and  here  we  are,2
4ZHwu0uut3k,UgzzzDc2-FDKUzZv4F94AaABAg,Maybe  someday  we  will  meet  here    again  ,0
4ZHwu0uut3k,Ugyk9YnQBZcKUEsbCRN4AaABAg,Merry  Christmas  everyone  ,329
4ZHwu0uut3k,UgzTIjO9-WZ-id2WBd94AaABAg,Happy  new  year  everyone    ,0
4ZHwu0uut3k,UgyG0l3iWgaMaIh0qfh4AaABAg,Does  anyone  know  where  I  can  find  the  original  photo  of  this,0
4ZHwu0uut3k,UgyAtEoanweJB4CwCt94AaABAg,rare  case  where  the  remix  is  better  than  the  original  ,1
4ZHwu0uut3k,Ugyd4L3ms68sjs_lm3B4AaABAg,i  was  driving  down  a  Canadian  highway  with  a  woman  that  led  me  on  a  4  hour  hike  on  a  snow  covered  mountain  where  she  lead  us  astray  and  night  started  to  fall    she  had  a  crazy  dog    but  a  genius  dog    he  lead  us  back  and  most  likely  saved  our  lives    when  we  got  back  to  her  truck  her  roommates  truck    the  windows  were  smashed  and  all  the  stuff  was  taken    including  a  macbook  pro    a  phone  and  sentimental  priceless  to  her    notes  she  took  while  traveling  india    I  wiped  the  glass  with  the  hoodie  i  wore  under  my  jacket    it  ripped    I  sat  in  the  back  holding  the  crazy  dog  from  jumping  out  the  window  as  we  were  driving  as  he  would  lunge  at  the  street  lights  and  oncoming  cars    we  got  back  to  the  starbucks  parking  lot  where  i  had  parked  my  friends  car  i  borrowed  to  drive  there    inside  the  starbucks  happened  to  be  some  officers  where  she  ran  in  to  get  a  case  going    after  30  minutes  of  a  freezing  interview  we  were  off    we  drove  to  a  gas  station  where  she  was  filling  her  roommates  truck  with  gas    a  homeless  man  asked  her  for  money    while  I  was  sitting  my  friends  car  with  her  dog  I  watched  her  seat  the  homeless  man  in  her  truck    as  we  were  in  a  rush  to  get  back  to  her  house  to  let  her  roommate  know  the  news  I  was  so  confused    anyways  i  followed  them  and  she  drove  to  a  cafe  she  used  to  work  at    we  arrived  and  she  came  to  car  saying  this  man  needed  some  food    we  went  inside  and  the  cafe  gave  us  water  and  some  food    they  didnt  give  it  to  us    i  opened  my  wallet  but  at  that  point  was  happy  she  wasnt  crying  anymore    while  sitting  there  with  them  she  left  the  table  to  go  talk  to  her  roommate  over  the  phone    I  then  sat  with  this  poor  soul  who  admitted  he  had  been  using  heroin  constantly  for  years  and  that  he  was  uncomfortable  where  he  was  and  stated  to  me  he  was  just  as  confused  as  to  why  she  brought  him  here    when  she  came  back  she  came  with  a  notebook  and  then  started  to  do  a  medical  diagnosis  on  this  man  she  had  been  studying  for  a  medical  exam  some  time  in  her  past  this  will  feed  into  the  story  later      the  man  finally  freaked  out  after  sitting  there  for  so  long  and  said  he  just  wanted  to  leave    it  was  so  strange  to  see  someone  wanting  to  help  someone  in  this  manner  from  where  i  come  from    but  thats  not  to  say  i  couldnt  respect  it    after  she  told  this  man  several  solutions  in  regards  to  where  he  could  go  on  this  freezing  night  she  finally  agreed  to  leave  him    back  in  our  cars  we  went    she  in  the  truck  and  I  in  my  friends  car  with  her  dog    as  we  pulled  out  of  the  lot  she  was  going  at  a  crazy  speed  out  of  no  where    she  ran  multiple  reds  and  i  eventually  lost  her    having  her  dog  in  the  back  I  was  totally  lost  I  didnt  know  what  to  do        my  mobile  plan  is  with  freedom  mobile  which  has  limited  service  in  that  area  so  i  was  just  driving  around  hoping  to  find  another  starbucks  or  mcdonalds  or  anywhere  with  free  wifi    finally  i  found  a  spot  which  was  a  car  part  store  I  can  no  longer  recall  the  name  of  but  it  had  free  wifi  for  shaw  users  freedom  was  a  daughter  company  of  freedom      I  went  on  facebook  and  tracked  down  the  roommate  who  told  me  her  address    I  made  it  to  this  house  where  the  girl  I  was  following  was  no  where  to  be  found    the  roommate  came  out  with  her  parents  and  they  were  completely  emotionally  having  heard  their  truck  had  all  the  windows  smashed  and  seeing  me  there  with  the  dog  but  no  girl  and  no  truck    I  hug  the  roommate  as  I  met  her  when  I  met  this  girl  I  was  with  at  a  club  where  I  worked  in  vancouver  far  from  where  I  was    the  parents  seemed  on  edge  but  understandingly    after  a  tearful  while  finally  after  the  girl  arrived    she  was  retracing  her  steps  trying  to  find  me  after  realzing  she  ditched  me  in  the  rush    the  roommate  and  her  parents  then  chose  that  moment  to  state  this  girl  was  no  longer  welcome  in  their  house        it  was  a  freezing  night  in  canada    the  girl  I  was  with  in  her  words  said  her  own  parents    disowned  her    but  i  told  her  to  call  them  anyways  and  after  a  while  she  finally  caved  and  called    but  her  dad  was  as  cold  as  the  night    his  voice  seemed  responsible  though  and  the  words  he  spoke  haunt  me  today    I  will  not  reveal  them  but  it  seemed  this  girl  had  done  something  to  those  within  her  family  unforgivable    it  was  at  that  point  though  i  didnt  really  know  her  i  invited  her  and  her  dog  back  to  my  mothers  house  which  was  a  2  hour  drive  back  to  the  city  the  hike  was  supposed  to  be  a  2  hour  venture    it  was  around  10pm    having  no  options  she  agreed    we  then  drove  with  this  song  on  repeat    stopping  at  a  few  stores  to  get  dog  food  and  food  for  ourselves    2  hours  later  we  arrive  in  the  city  but  I  could  not  go  home  as  I  left  my  electric  car  with  my  friend  and  the  deal  was  I  take  her  gas  car  and  return  to  him  before  he  left  work  so  we  had  to  go  directly  to  the  club  where  I  worked  to  do  the  exchange    we  got  there  and  took  the  dog  for  a  short  walk  before  leaving  it  in  the  parkade  with  my  car    the  dog  being  part  wolf  not  actually  but  the  energy  this  thing  had  I'd  describe  it  like  that    was  still  bouncing  around  so  I  told  her  to  wait  however  she  stated  she  didnt  want  to  wait  for  me  and  came  with  me  into  the  club    we  got  into  the  club  and  the  ladies  stopped  her  to  check  her  id  which  she  didnt  have  because  she  wasnt  allowed  to  go  into  the  house  to  get  any  of  her  things    should  have  mentioned  that  but  I'm  already  exceeding  every  other  youtube  comment  you've  ever  seem  so  I'm  not  going  back  to  correct  it  sorry    so  we  had  to  wait  at  the  door  wherefinally  the  owner  my  employer  and  friend    came  and  allowed  the  entry    as  we  walked  in  the  craziest  sound        this  song  once  again      it  was  the  final  hour  so  the  djs  had  been  wrapping  up  so  someones  phone  was  in  the  aux  even  though  the  club  still  had  a  big  pop  inside  it    we  danced  which  I  never  do    for  the  last  minute  of  it    it  was  a  brief  moment  of  peace  in  a  time  of  uncertainty  for  both  this  woman  and  I    the  story  continues  and  goes  quite  south  actually    including  her  using  my  library  card  to  rent  a  MCAT  book  and  never  returning  it  I  include  this  only  cause  I  promised  above    didnt  think  there  was  so  much  my  goodness    after  staying  more  then  a  week  at  my  mothers  house  while  I  paid  for  her  dogs  food  as  she  had  no  money    i  was  more  then  happy  with  that    in  fact  at  the  end  I  loved  the  dog  and  not  her  loll    during  these  times  she  continued  these  crazy  occurrences  for  example  the  times  she  insisted  we  had  s      inside  mycar  yet  while  on  parked  beside  the  public  side  walk  while  charging  my  electric  car  on  the  streets  of  vancouver  im  not  kidding  when  I  say  she  insisted    I  literally  told  her  no  and  she  undressed  herself    it  was  something  my  inner  barbarian  that  could  not  refuse  but  regrets  given  the  amount  of  people  that  walked  by  lord  save  me      I'm  going  to  end  this  now    I  have  had  to  replay  the  song  4  times  during  the  writing  of  it    I  have  finally  given  up  proof  reading  I  hope  it's  legible    I  feel  I  could  write  triple  this  paragraphs  in  the  events  that  followed    like  how  I  finally  got  her  out  of  my  mothers  house  or  how  she  treated  my  brother  while  staying  with  us    or  how  the  encounter  went  getting  1  of  the  2  books  back  whle  I  had  another  girl  in  the  car  to  shield  my  inner  barbarian  from  action  LOL    crazy  times    I  thank  the  lord  my  life  is  much  more  peaceful  now    its  funny  cause  as  a  young  man  you  wish  for  crazy  times  like  that  and  crazy  s      experiences  but  when  I  finally  got  it  and  was  stuck  in  the  middle  I  finally  learned  I  was  wrong    if  you  actually  read  all  this  cheers  to  you    good  luck  in  life  ,0
4ZHwu0uut3k,UgyB2aGrQJ8XS8ODfI54AaABAg,Dude  2013  and  2014  were  golden  years    2020  wtf  happened  to  everyone  ,0
4ZHwu0uut3k,Ugw2jmOXdOhGNSwP4zB4AaABAg,great    but        THE  PERCUSSION  IS  TOO  LOUD            ,0
4ZHwu0uut3k,UgyO-fR-xM9MYEuTKCd4AaABAg,re  liking  this  so  it's  at  the  top  of  my  liked  videos  ,1
4ZHwu0uut3k,UgxNAoQq-5ewEDls1pp4AaABAg,Tom    it  hurts  bruh      ,0
4ZHwu0uut3k,Ugy00eqONvlSqf7-oEp4AaABAg,I  love  that  beat  ,4
4ZHwu0uut3k,Ugz0A2mCNMlSNuAnqjN4AaABAg,Happy  new  year  guys,0
4ZHwu0uut3k,UgypkM8YqdF1JSH9-9V4AaABAg,Happy  New  Year  Everyone  ,0
4ZHwu0uut3k,Ugymwo6Mcln4DNfb5OR4AaABAg,So  many  memories  linked  to  this  one  song    jesus  christ    Time  really  does  fly  by      ,3
4ZHwu0uut3k,Ugw2GIRpE6EQDJXAh0h4AaABAg,to  my  gf    i  love  you  if  ur  reading  this  ,2
4ZHwu0uut3k,UgzUdOUk5ehBiBbr2Od4AaABAg,i  just  saw  life  in  a  year  and  first  vid  i  see  is  this,0
4ZHwu0uut3k,Ugxd-GYwgfkb7Ik0EVZ4AaABAg,One  of  my  favorite  tracks  keep  it  up    D,3
4ZHwu0uut3k,Ugz99CTEzKvL6T8gYih4AaABAg,this  and  let  her  go  are  both  songs  that  hit  in  a  different  way      ,4
4ZHwu0uut3k,UgyVUsMG-gmleRIlCvx4AaABAg,YOOOOOO  today  s  a  special  day    Anyone  listening  on  a  Friday                                  ,1
4ZHwu0uut3k,Ugykod4boK4FyUgxki14AaABAg,Happy  new  christmas,0
4ZHwu0uut3k,UgwJxpUCHycuQAJKqUZ4AaABAg,that  voice  makes  me  feel        makes  me  fell  I  clicked  on  wrong  video,1
4ZHwu0uut3k,Ugz9fh03U2wU_q_y8UJ4AaABAg,Life  is  hard  ,0
4ZHwu0uut3k,UgxIBUsprlm--fdlltB4AaABAg,Happy  new  year    ,0
4ZHwu0uut3k,Ugx6zVc-4y_p0bu-oht4AaABAg,happy  new  year  2021,0
4ZHwu0uut3k,Ugz-qFgAN5E-WhXEUtR4AaABAg,Another  love  ,0
4ZHwu0uut3k,UgxRdNW9nIAAJ8z0xJd4AaABAg,Just  to  let  everyone  know  BBC  AND  VEVO  NO  LONGER  EXCEPTED  ON  THIS  WEBSITE        MO  ,0
4ZHwu0uut3k,UgyMkbk2dEb83qEls9V4AaABAg,What  name  woman    She  is  beautiful  ,0
4ZHwu0uut3k,Ugwb0_s8fTahM48U7qB4AaABAg,Classs,0
4ZHwu0uut3k,Ugx1lJbbyrzoBPjX22Z4AaABAg,how  to  pronounce  it    Uh  NUH  thuh  Luvh  ,1
4ZHwu0uut3k,UgxOveWi1j9S7nyYwu54AaABAg,its  been  7  years,0
4ZHwu0uut3k,Ugw1kAq_whK9ahuPvpx4AaABAg,This  music  song  still  going  strong    huh    I'm  surprised    But  this  rythm  is  just  addicting  anyway  ,1
4ZHwu0uut3k,Ugy4ZlP1UwnSUKxB0NV4AaABAg,this  picture  is  how  i  got  to  know  about  cara  delevigne      ,2
4ZHwu0uut3k,UgwvtC5R0E4B0T55r194AaABAg,btw  who's  the  girl  shes  so  pretty  ,0
4ZHwu0uut3k,Ugxbc6euMRI1efcZ-TZ4AaABAg,who  listening  in  2021    ,1
4ZHwu0uut3k,UgzNhU5wohTXVKSSZst4AaABAg,Hope  tik  tok  never  fine  this  music,3
4ZHwu0uut3k,UgxhpXGW61yK46rI7yV4AaABAg,What    you  don't  know  about  Cara  ,0
4ZHwu0uut3k,UgxVHZO5WtYWCsRM2fp4AaABAg,1  40  dog    help  my  please,0
4ZHwu0uut3k,UgzxTycOjkJ05LOi82l4AaABAg,Hu's  Here  Now    burning  Down  Off  Flame's  of  Pur    Deep  In  Honest    My  Friends  Leave  Free  Always  go  Back  In  Freee  Your  Mind  that  the  Trut  About    Life'  Today    Another  love  All  My  Tears'  Hand  Bend  use  out    ,0
4ZHwu0uut3k,UgyyZzBkhyyOrmJcfqR4AaABAg,Cara  is  so  hot,0
4ZHwu0uut3k,UgxR2R1PCx8S06Ddj8N4AaABAg,Who  is  that  beatiful  girl    ,0
4ZHwu0uut3k,Ugwr2BQYAaeM6pCJcqF4AaABAg,24  night  of  chrismas  hapy  chrismes  for  the  people  ,20
4ZHwu0uut3k,UgxjwfOIM27WeicpAr14AaABAg,anyone  still  here  ,0
4ZHwu0uut3k,UgidlOxq6b8VQXgCoAEC,  I  love  this  song  so  much,161
4ZHwu0uut3k,Ugxa10oL2CWXOWK8g5Z4AaABAg,Who's  here  2021  ,0
4ZHwu0uut3k,Ugz0H-5JUC-uqx-T1Wl4AaABAg,Whats  is  this  girl  please    Qui  est  cette  personne  en  image  svp  ,0
4ZHwu0uut3k,Ugy2potDDRKvSxsAzeR4AaABAg,GIFTE  NEW  TUBELIGHT  7  AND  ONE  FRAME  CHOKE  OMEY  THANKYOU  YOU  RUSSIA,0
4ZHwu0uut3k,Ugw8rgtffSjHKlAnR854AaABAg,Is  my  favorite  song,4
4ZHwu0uut3k,UgwuMei_2eqtaBCU64B4AaABAg,Who  right  now  hey  salu2  Las  Vegas  2021,0
4ZHwu0uut3k,UgyxftSvmlUitoJcbgV4AaABAg,This  song  makes  me  kinda  happy  about  those  sad  moments  in  my  life  and  it  also  kinda  gives  me  hope  for  future  idk,13
