Video ID,Comment ID,comments,Likes
4ZHwu0uut3k,UgxUzYwpfcr8QeTpIzx4AaABAg,BE  YOURSELF      NOT  MODEL    FANNY        ,0
4ZHwu0uut3k,Ugwy0DI54MKaehpsu2l4AaABAg,Cara  Delevingne  is  a  perfect  album  art  for  this  song    ,13
4ZHwu0uut3k,UgymZFkQiwO4HdzVyTt4AaABAg,who's  the  girl  on  the  image  ,0
4ZHwu0uut3k,Ugyx1P0Af3wfEFJrTL14AaABAg,The  first  minute  of  this  beat  is  an  absolute  masterpiece  ,27
4ZHwu0uut3k,UgxxIjWJNT82L6gp7yB4AaABAg,I  love  listening  to  this  song  with  full  bass    great  job      Greetings  from  Poland    ,25
4ZHwu0uut3k,UgxuN6K2_jgk3ZcGV714AaABAg,pick  a  better    looking    girl    on  the  thumbnail  next  time  plz,0
4ZHwu0uut3k,UghV7S-0bQ4boXgCoAEC,Lyrics        wanna  take  you  somewhere  so  you  know  I  care  But  it's  so  cold  and  I  don't  know  where  I  brought  you  daffodils  in  a  pretty  string  But  they  won't  flower  like  they  did  last  spring    And  I  wanna  kiss  you    make  you  feel  alright  I'm  just  so  tired  to  share  my  nights  I  wanna  cry  and  I  wanna  love  But  all  my  tears  have  been  used  up    On  another  love    another  love  All  my  tears  have  been  used  up  On  another  love    another  love  All  my  tears  have  been  used  up  On  another  love    another  love  All  my  tears  have  been  used  up    And  if  somebody  hurts  you    I  wanna  fight  But  my  hands  been  broken    once  too  many  times  So  I'll  use  my  voice    I'll  be  so  fucking  rude  Words  they  always  win    but  I  know  I'll  lose    And  I'd  sing  a  song    that'd  be  just  ours  But  I  sang  'em  all  to  another  heart  And  I  wanna  cry  I  wanna  learn  to  love  But  all  my  tears  have  been  used  up    On  another  love    another  love  All  my  tears  have  been  used  up  On  another  love    another  love  All  my  tears  have  been  used  up  On  another  love    another  love  All  my  tears  have  been  used  up    I  wanna  sing  a  song    that'd  be  just  ours  But  I  sang  'em  all  to  another  heart  And  I  wanna  cry    I  wanna  fall  in  love  But  all  my  tears  have  been  used  up    On  another  love    another  love  All  my  tears  have  been  used  up  On  another  love    another  love  All  my  tears  have  been  used  up  On  another  love    another  love  All  my  tears  have  been  used  up,46
4ZHwu0uut3k,Ugxdf47p91aKjebbs1R4AaABAg,The  girl  on  picture  is  Tom  Odell    but  female  ,0
4ZHwu0uut3k,UgiUwqzbi3pexHgCoAEC,Moment  when  you  realize  that  remix  has  more  views  than  original  song,3
4ZHwu0uut3k,Ugx822Q4m_pod5s8oc94AaABAg,Another  Love    I  wanna  take  you  somewhere  so  you  know  I  care    But  it's  so  cold  and  I  don't  know  where    I  brought  you  daffodils  on  a  pretty  string    But  they  won't  flower  like  they  did  last  spring  And  I  wanna  kiss  you    make  you  feel  alright    I'm  just  so  tired  to  share  my  nights    I  wanna  cry  and  I  wanna  love    But  all  my  tears  have  been  used  up  On  another  love    another  love    All  my  tears  have  been  used  up    On  another  love    another  love    All  my  tears  have  been  used  up    On  another  love    another  love    All  my  tears  have  been  used  up  And  if  somebody  hurts  you    I  wanna  fight    But  my  hand's  been  broken    one  too  many  times    So  I  use  my  voice    I'll  be  so  fucking  rude    Words    they  always  win    but  I  know  I'll  lose  And  I'd  sing  a  song    that'd  be  just  ours    But  I  sang  'em  all  to  another  heart    And  I  wanna  cry  I  wanna  learn  to  love    But  all  my  tears  have  been  used  up  On  another  love    another  love    All  my  tears  have  been  used  up    On  another  love    another  love    All  my  tears  have  been  used  up    On  another  love    another  love    All  my  tears  have  been  used  up    Oh    need  a  love    now    my  heart  is  thinking  of    I  wanna  sing  a  song  that'll  be  just  ours    But  I  sang  'em  all  to  another  heart    And  I  wanna  cry    I  wanna  fall  in  love    But  all  my  tears  have  been  used  up  On  another  love    another  love    All  my  tears  have  been  used  up    On  another  love    another  love    All  my  tears  have  been  used  up    On  another  love    another  love    All  my  tears  have  been  used  up,138
4ZHwu0uut3k,UgxijW9fHG9K_dWaiBR4AaABAg,Probably  the  most  beautiful  I've  heard  in  my  life    ,109
4ZHwu0uut3k,UgxLe7BCRA1jLE63SHF4AaABAg,I  thing  Thanisorn  Easy  tell  ,3
4ZHwu0uut3k,UgxhzeDZXCbE662qyg54AaABAg,It  is  a  beautiful  BEAUTIFUL    song    3,4
4ZHwu0uut3k,UgxvJ3j4lJNHkurpz0x4AaABAg,WOW    Come  back  here  weekly  to  hear  this  masterpiece  combinated  by  Tom      Zwette  ,19
4ZHwu0uut3k,UgyeO5OWXMdCQ4vbbmh4AaABAg,Who  is  that  girl  on  the  video  ,0
4ZHwu0uut3k,UgzBVZH-mPsB3KTVZvN4AaABAg,Love  this  song    ,0
4ZHwu0uut3k,UgzlMIRw1jYZCiaOIaJ4AaABAg,It  touchs  my  soul    so  deeply    love  it  ,0
4ZHwu0uut3k,UgwCWDqcL1-_7_j-Zkl4AaABAg,What  a  voice  ,0
4ZHwu0uut3k,UgzV6D8b58J9uy9vq8x4AaABAg,Absolutely  loved  it  3,0
4ZHwu0uut3k,UgyA9Iaudi_yzzY9XCJ4AaABAg,I  really  like  this  song  it's  very  Emotional  ,1
4ZHwu0uut3k,Ugyk_LrIVRky7BqECY94AaABAg,Damn  finns    first  boom  funk  mc    and  now  this      Beautiful  song    and  can't  take  my  eyes  of  the  photo  while  listening    thinking        Very  well  done  ,1
4ZHwu0uut3k,Ugx0FXv9mQVDMPyycnR4AaABAg,i  almost  forgot  how  beautiful  this  song  is  ,0
4ZHwu0uut3k,UgjMieYtL7YZI3gCoAEC,Tom  Odell  has  one  of  the  best  voices,3
4ZHwu0uut3k,UgxPFbUX1nXI7kobqBN4AaABAg,This  song  is  still  hitting  the  part  of  me    Even  in  2020,3
4ZHwu0uut3k,UgzcDCl0ujwePAfPGZN4AaABAg,I  still  love  this  song  2020,0
4ZHwu0uut3k,Ugi0Xg_x-KEho3gCoAEC,this  is  epic    I  love  it        ,3
4ZHwu0uut3k,UgyTf86B7xYgSbwVU-l4AaABAg,When  done  right  remixes  can  always  be  better  than  an  original,1
4ZHwu0uut3k,Ugy5OdhCIy_Q4O97uzl4AaABAg,Seven  years  later    I  am  still  enjoying  listening  to  this  timeless  song  ,2
4ZHwu0uut3k,UgyYWETU_ZmJOB6DOTB4AaABAg,when  lyrics  and  sound  hurts  you  feel  the  pain  through  your  veins  thats  actually  a  sad  and  powerful  feeling      ,3
4ZHwu0uut3k,UgzvY44yjWPZAcfEyJ94AaABAg,This  song  makes  me  sooo  sad  but  still    I  must  dance            so  let  the  tears  fly  ,12
4ZHwu0uut3k,Ugg2SzcsimrbDXgCoAEC,Cara  Delevigne  is    personally    one  of  the  most  beautiful  women  ever    Her  facial  features  are  bold    her  face  shape  is  unique  and  her  bone  structure  is  to  die  for  ,3
4ZHwu0uut3k,UgwBNAzIsqf4aRBmitt4AaABAg,This  song  takes  me  anywhere  I  want  to  be  ,0
4ZHwu0uut3k,UgyTiuivxBLGKU8KNSB4AaABAg,What  I  ve  experienced  in  this  year  makes  me  feel  all  the  pain  in  this  one  song  never  been  so  depressed  in  my  life,0
4ZHwu0uut3k,UgxXJi2wfEi1uTlyZox4AaABAg,She  is  absolutely  hypnotizing  ,0
4ZHwu0uut3k,Ugxpug94v31rPt3F35B4AaABAg,This  is  so  nostalgic      ,2
4ZHwu0uut3k,UgyxoowDv-kqRrbFHUR4AaABAg,this  sounds  so  2013    seems  like  yesterday,5
4ZHwu0uut3k,UgwONVKUEv7idadQJiZ4AaABAg,Every  time  I  hear  this  song  I  think  of  my  father  who  passed  away  last  year  ,4
4ZHwu0uut3k,Ugxz3IWmYzqkYoRwC_l4AaABAg,This  song  fits  to  every  mood,3
4ZHwu0uut3k,Ugz7IuwdRPe-Uk2d0x94AaABAg,i    wanna  make  this  my  ring  tone  in  2020,0
4ZHwu0uut3k,UgwgQ2v5AShBFzGX4N54AaABAg,When  the  heart  is  broken  cuz  of  love  ,1
4ZHwu0uut3k,UgyfAOPDta1sgqU24xd4AaABAg,In  my  heart  ,2
4ZHwu0uut3k,Ugj-zb_0FZw4CXgCoAEC,This  song  really  makes  me  chilled  and  in  the  same  time  i  wanna  move  to  the  beats    3,3
4ZHwu0uut3k,UgyLFoPTkCeSTiRJnf54AaABAg,I  remember  I  used  to  love  this  song  so  much    I  listened  to  it  every  single  day    I  searched  for    Kygo    because  I  wanted  to  feel  nostalgia  and  damn  I  got  excited  when  this  song  got  recommended    It  feels  different  now    the  lyrics  hit  different  after  so  many    yet  so  little  years  ,4
4ZHwu0uut3k,UgwVweJ-5_Pawy2vZXd4AaABAg,Even  thought  New  relationships  can  nurture  and  fill  what  we  need    some  Days  I  still  feel  empty    and  I  start  to  think  that  this  is  not  gonna  change    Maybe  I'm  too  old  for  the    Magic  Love    idea,14
4ZHwu0uut3k,Ugx4Uy5wx9YQZER9ol94AaABAg,Dam  I  feel  on  another  low  everytime  I  listen  to  this  song    things  get  brought  out  by  certain  things    but  it  doesn't  mean  you  are  weak  to  show  emotion  ,46
4ZHwu0uut3k,UgyrWjfxwwYt-lDXCzB4AaABAg,Did  you  know      The  song  that  can  make  you  happy    smile    and  cry  at  the    same  time  is  the  best  of  all  time  ,3
4ZHwu0uut3k,UgzLExc55ri-PTDMooV4AaABAg,This  one  takes  me  higher      from  India  ,1
4ZHwu0uut3k,UgyFNgSCGkhOWckv56h4AaABAg,Omg    Just  omg    wow    I  love  it  too  much    and  this  young  lady  it  does  not  matter  how  is  old  she    is  so  beautiful  Actually  I  listened  this  2  years  ago  and  saw  this  lady    I  searched  her    and  I  fell  in  love  with  her    I  hope  the  same  feelings  like  mine  support    me  because  it  is  not  local  it  is  global  feelings    Sorry  for  my  english    ,2
4ZHwu0uut3k,Ugia2HC7rCfxx3gCoAEC,Superb  mix  but  nothing  beats  the  original  version    3,3
4ZHwu0uut3k,UgzwF3qPpEpCIFEyCu54AaABAg,      this  is  so  damn  beautiful        found  this  song  recommended  from  someone  on  another  favorite  song        Lykke  Li    I  Follow  Rivers    flicflac  remix  ,28
4ZHwu0uut3k,Ugwz0RWa5GHvJM80Qz14AaABAg,N  wanna  kiss  u  to  make  u  feel  alright      love  it      ,1
4ZHwu0uut3k,UgzEJVmgxpzJZgBh8ot4AaABAg,This  is  a  remix  of  the  decade  isn't  it    So  many  memories,0
4ZHwu0uut3k,Ugy4CY0gleykzFiv4Yd4AaABAg,I  remember  listening  to  this  7  years  ago  and  think  how  pretty  the  girl  was  and  had  no  idea  it  was  cara  delevingne    still  a  great  tune    ,2
4ZHwu0uut3k,Ugwoi-lPolR8fcYhn8l4AaABAg,i  love  the  music        3,1
4ZHwu0uut3k,UgyMBCIoGqXWk_YkyaF4AaABAg,Damn  this  song  really  blew  up  ,0
4ZHwu0uut3k,UgwE1dkG9Yy8dOlF0QZ4AaABAg,This  is  soo  2000s    ,1
4ZHwu0uut3k,UgxhdOCTx45CUNcjCKJ4AaABAg,This  song  is  BEAUTIFUL    IS  VERY  COOL,3
4ZHwu0uut3k,Ugxoan7e54eqLCJX7gt4AaABAg,Always  come  back  to  this  song    Idk      it's  just  like  the  lyrics  are  stuck  in  my  mind  and  the  vibes  are  so  relaxing  yet  depressing    I  love  it,3
4ZHwu0uut3k,UgyAtLxflk5NfXDsXjF4AaABAg,Makes  me  sad  about  relationships  ive  never  had,0
4ZHwu0uut3k,Ugym2XA7VzlZGTIO_Fh4AaABAg,This  song  has  exactly  double  the  views  as  the  original,0
4ZHwu0uut3k,UgynzdouzMNZb8pxV2N4AaABAg,Nostalgia  is  the  best  worse  feeling  ever,2
4ZHwu0uut3k,Ugw-xHSkks4hnKSyiOl4AaABAg,They  truly  have  been  used  off  damn,1
4ZHwu0uut3k,Ugy1aHLrkWsDZzomE_F4AaABAg,It  misses  the  best  part      ,1
4ZHwu0uut3k,UgjznAX7_cMMVHgCoAEC,When  i  listen  this  song  i  dont  even  get  sad  or  something  like  that    MY  MIND  IS  FLYING  AWAY  WITH  MY  FEELINGS  ON        ,3
4ZHwu0uut3k,UgxZInBRC8343uq4U4t4AaABAg,Actually  Thats  the  Sound  that  I  need  XD,3
4ZHwu0uut3k,Ugz0HuDDuMzkGkyY9BB4AaABAg,Whoever  reads  this    you're  awesome  smoke  some    you  deserve  it  ,11
4ZHwu0uut3k,UgxKByQqvV85KzPHibN4AaABAg,13  11  2020  old  memories  ,2
4ZHwu0uut3k,UgwJ0swbnS8KsZBBe1l4AaABAg,It's  you    And  you      Only  you      That's  my  mistakes  are  encircled  ,0
4ZHwu0uut3k,UgzlycbEWyDb5Vz8zJl4AaABAg,Still  here  10  years  strongggg,1
4ZHwu0uut3k,UgxD_EhtFWgNh2XDonl4AaABAg,cool  edit          ,0
4ZHwu0uut3k,UgyKyYR4w3NwXTAFOUp4AaABAg,I'm  the  one  who  listened  170  000  times,0
4ZHwu0uut3k,UgxduATZmbY3PUc1Pc94AaABAg,Its  autumn  so  I  coming  back,1
4ZHwu0uut3k,UgwrBCa-G4qyLp4zXyp4AaABAg,Cara  Delevingne        Can't  stop  looking  at  her  face  ,6
4ZHwu0uut3k,UgwlgepYXm1KY61rUoB4AaABAg,My  respects    I  greet  you  from  Romania,0
4ZHwu0uut3k,UgibIY0NsJsRv3gCoAEC,i  listened  this  3  years  ago  and  it  was  just  beutiful  song    but  only  now  i  tryied  to  listen  to  this  song's  lyrics  and  i  understood  that  this  song  is  much  more  beutiful  than  i  thought  ,3
4ZHwu0uut3k,Ugz0PGNq5fstub9q7aV4AaABAg,im  still  here  enjoying  the  music    oct  21      2020  ,1
4ZHwu0uut3k,Ugx_ZUSH-C5WJId_rDV4AaABAg,I  remember  this  song  when  it  had  170  k  views,0
4ZHwu0uut3k,UgxOVdyFBjMSPAeWuD14AaABAg,  Love  this  song  ,3
4ZHwu0uut3k,UgiY-v1IZSberHgCoAEC,i  love  this  song                                                  ,3
4ZHwu0uut3k,UgxB3YYOSnpumNKiP1V4AaABAg,Extended  relaxation,3
4ZHwu0uut3k,UgwE-WmAeBs0VBpTtGx4AaABAg,What  a  beatiful  woman,0
4ZHwu0uut3k,UgxIysrPO00D8gBERLp4AaABAg,Pray  for  safe  journey  to  the  rest  of  you  life  ,0
4ZHwu0uut3k,UgwvjBvCcTxckSr9FOp4AaABAg,Who  else  needs  to  listen  to  this  every  year  as  the  leaves  begin  to  change  color  and  the  weather  gets  colder  while  walking  through  a  park  alone    thinking  about  another  summer  gone  ,2
4ZHwu0uut3k,UgwxQ9GAoqog7A5aryh4AaABAg,I  genuinely  can't  chose  between  this  remix  and  the  original    I  love  them  both  so  much,3
4ZHwu0uut3k,Ugx8J9O5RMQTKuXD41Z4AaABAg,Good  music  here,0
4ZHwu0uut3k,UgzD6NwsQfx57v6TXuZ4AaABAg,I  don't  know  how  i  got  here    but  staying  ,140
4ZHwu0uut3k,UgzE8dGgxh2_VjJBAP94AaABAg,I  open  this  only  for  Cara  Queen,6
4ZHwu0uut3k,UgzUrcft6s7JVXll-Mp4AaABAg,Absolutely  excellent  track,3
4ZHwu0uut3k,UgyXR3l33A4aOPfZSWJ4AaABAg,Of  course  I  still  love  you      Cordelia  ,2
4ZHwu0uut3k,Ughrxks-guSFqngCoAEC,This  is  beautiful  song    its  sad  that  remix  has  more  views  than  original  one  ,3
4ZHwu0uut3k,Ugx8mo8skkxuHWYmYdx4AaABAg,My  misses  says  this  song  is  helping  her  through  labour  but  gas  and  air  is  helping  me,0
4ZHwu0uut3k,Ugy_E_KGFBB_aT04s814AaABAg,Good  job  making  this  I  bet  it  was  hard  but  worth  it  for  you  bro    Have  a  nice  day,3
4ZHwu0uut3k,UgzxePephz-iceFK-V94AaABAg,One  of  the  songs  my  hands  can't  stop  from  playing  even  if  I  only  have  my  leg  or  a  dashboard  instead  of  my  piano  ,0
4ZHwu0uut3k,UgyYOTHWutDUu4F64r54AaABAg,This  song  made  Cara  famous  ,0
4ZHwu0uut3k,UgyMMNgXEhvJlXTCL1l4AaABAg,Song    play  in  Lanna  Gym  Praque          This  is  my      2018  2019          Thnx  for  All      ,4
4ZHwu0uut3k,Ugw9-X0fDYb6vIQ4EDB4AaABAg,Who  is  here  in  2021    Still  bangs  9  years  on    ,0
4ZHwu0uut3k,UgwWF2WzMNmXh3i1mSB4AaABAg,  Another  love    is  one  of  the  more  efficient  ways  for  me  to  chill  out    Thanks  Tom  Odeel  and  TheSoundYouNeed  ,3
4ZHwu0uut3k,UgyIqFF6D--8tXpSr194AaABAg,Nostalgia    heart  warming    if  you're  still  watching  in  20xx    you  got  good  taste  in  music    who  girl  picture    like  if  you  agree    There  I  just  summed  up  every  comment  on  every  song  on  youtube    You  never  have  to  read  these  cheesy  stupid  comments  again  ,0
4ZHwu0uut3k,UgzNV7DrzNqMSOqY2hB4AaABAg,7  years  ago  we  were  all  like    who's  that  girl  in  the  picture        D,21
4ZHwu0uut3k,UgwWcYlhtMJyuOgg2Xd4AaABAg,26million  views  the  original  song  515million  views  the  ReMiX,0
4ZHwu0uut3k,UggqE4QFVQUEk3gCoAEC,Freaking  great  ,3
4ZHwu0uut3k,UgxFL7P7VnAxXK2JhuF4AaABAg,On  another  low    another  low,1
4ZHwu0uut3k,UgyH7JEH0R90yOw3tbx4AaABAg,I'm  lost  in  this  song  ,0
4ZHwu0uut3k,Ugy1kNaWulmGlL13DvR4AaABAg,On  another  love      ,0
4ZHwu0uut3k,Ugxs_mD6Z1jHBCLZ6ZJ4AaABAg,wtff    remix          500m    wiev    original  song      200m      wiev,3
4ZHwu0uut3k,UgzyNRhwCBpyWj6-uDR4AaABAg,I  dunno  why  but  this  song  is  Indispensable  to  read  Warrior  Cats,0
4ZHwu0uut3k,UgyMkfeO7TAocri8lh14AaABAg,I  love  my  wife,0
4ZHwu0uut3k,UgxPbuuCFwo69wGKHUp4AaABAg,I  wanna  take  you  always  but  its                                                                                                  so  sold,0
4ZHwu0uut3k,UgzABoAaWaNn-AD9fh94AaABAg,this  strongly  touches  my  soul  man    3,3
4ZHwu0uut3k,Ugz6ennQUY-c_nLzzop4AaABAg,beatifoul,1
4ZHwu0uut3k,UgwF8XP86W36T24NejF4AaABAg,f        i  rememberd  her  again  ,1
4ZHwu0uut3k,Ugx2xGt8SWYIZL5vmDh4AaABAg,Who  listening  in  November  2020    ,3
4ZHwu0uut3k,UgycN6uIfN2RUtnu_Tt4AaABAg,Tropical  House  During  Pandemic    Election  2020  makes  be  sane,0
4ZHwu0uut3k,UgyMneD1aV7sE689zKJ4AaABAg,Tomorrowland  2014      ,0
4ZHwu0uut3k,Ugz14GunGbqL7_kM8Md4AaABAg,Remix  is  the  original  song  and  the    original  song  is  remix,0
4ZHwu0uut3k,UgxmPb58w5QZjaf-teF4AaABAg,who  hear  it  in  2020  ,0
4ZHwu0uut3k,Ugw8RGuqEXPScWfEMRB4AaABAg,Who  listens  in  2021,1
4ZHwu0uut3k,UgybvzKmEzsVhvO6It14AaABAg,Wow  this  remix  destroys  the  song    In  a  bad  way  ,0
4ZHwu0uut3k,UgzftPiRw3Mc5haEQ6h4AaABAg,That's  the  radio  host  from  Non  Stop  Radio,0
4ZHwu0uut3k,UgwSjT4qzmzHwCfvu514AaABAg,3  17    windows  crashes,1
4ZHwu0uut3k,Ugw9JyuW2PjcnKX2N7B4AaABAg,I  m  here  for  Cara,0
4ZHwu0uut3k,UgxKfxT5QLg3sD3MQal4AaABAg,Who  is  with  me  in  November  2020  ,0
4ZHwu0uut3k,UgxzDHGOJBKizy4t0WF4AaABAg,Stay  away  from  me,0
4ZHwu0uut3k,Ugw-JyeJLpjnmpCNrkV4AaABAg,Who  is  the  girl  in  the  video    Someone  know  it    ,0
4ZHwu0uut3k,Ugz8-md4i5GXQfW93f94AaABAg,Not  as  good  as  Dancin,0
4ZHwu0uut3k,UgzPnZUlyBPeE5QZ6jp4AaABAg,gap  so  long      why  create  this  song  like  this    shameless,0
4ZHwu0uut3k,UgzngA01tNBI9eekp8B4AaABAg,When  the  views  are  equal  to  1  16th  of  the  World  Population  ,0
4ZHwu0uut3k,UgxBX9_4gTI6l5MVooJ4AaABAg,I  wanna  take  you  somewhere  so  you  know  I  care    But  it's  so  cold  and  I  don't  know  where    I  brought  you  daffodils  in  a  pretty  string    But  they  won't  flower  like  they  did  last  spring    And  I  wanna  kiss  you    make  you  feel  alright    I'm  just  so  tired  to  share  my  nights    I  wanna  cry  and  I  wanna  love    But  all  my  tears  have  been  used  up    On  another  love    another  love    All  my  tears  have  been  used  up    On  another  love    another  love    All  my  tears  have  been  used  up    On  another  love    another  love    All  my  tears  have  been  used  up    Oh  oh    And  if  somebody  hurts  you    I  wanna  fight    But  my  hands  been  broken    one  too  many  times    So  I'll  use  my  voice    I'll  be  so  fucking  rude    Words  they  always  win    but  I  know  I'll  lose    And  I'd  sing  a  song    that'd  be  just  ours    But  I  sang  'em  all  to  another  heart    And  I  wanna  cry  I  wanna  learn  to  love    But  all  my  tears  have  been  used  up    On  another  love    another  love    All  my  tears  have  been  used  up    On  another  love    another  love    All  my  tears  have  been  used  up    On  another  love    another  love    All  my  tears  have  been  used  up    Oh  oh      Oh    need  a  love    now    my  heart  is  thinking  of      I  wanna  sing  a  song    that'd  be  just  ours    But  I  sang  'em  all  to  another  heart    And  I  wanna  cry    I  wanna  fall  in  love    But  all  my  tears  have  been  used  up    On  another  love    another  love    All  my  tears  have  been  used  up    On  another  love    another  love    All  my  tears  have  been  used  up    On  another  love    another  love    All  my  tears  have  been  used  up  oh  oh,223
4ZHwu0uut3k,UggKSB4lfZQGzngCoAEC,This  song  is  emotiol  for  me,3
4ZHwu0uut3k,Ugw5rSeg3gNoSs9zmfp4AaABAg,Thank  you  for  making  this  ,9
4ZHwu0uut3k,UghMYl7TEOzY-3gCoAEC,How  could  Cara  Delevingne  stay  and  stare  at  the  camera  for  6  minutes  without  any  move  ,2029
4ZHwu0uut3k,Ugy49yOuJ9zhzPeF47p4AaABAg,Margo  is  that  you  ,0
4ZHwu0uut3k,UgxUfKWTeguNeh6C63d4AaABAg,Love  this  ,0
4ZHwu0uut3k,Ugy2YjwMjgZcsBF9vcx4AaABAg,Nice  one      Love  this  remix  ,0
4ZHwu0uut3k,UgxWQKAkyZLujbpMODR4AaABAg,One  of  the  best  song  ever      ,2
4ZHwu0uut3k,Ugz72uNGTdCgKgOGCuh4AaABAg,i  love  this  song    3,0
4ZHwu0uut3k,UgzxqBRG58aTfINyTrt4AaABAg,Been  loving  this  for  years,0
4ZHwu0uut3k,Ugyfa414nd627OdaGF14AaABAg,FINALLY  I  FOUND  IT    Love  this  song  ,1
4ZHwu0uut3k,UgzudgcHMc49E_XlMI94AaABAg,omg  2020  and  still  love  this,0
4ZHwu0uut3k,UgzcLF30GVNDZr0GSMp4AaABAg,I  love  this  song  OMG,1
4ZHwu0uut3k,UgzQr0RU7izUGc2Ceip4AaABAg,I  first  heard  this  remix  of  a  song  i  already  adored  at  an  Italian  restaurant    of  all  places              It  was  late  and  my  team  had  decided  to  go  out  for  dinner  after  we  won  a  volleyball  tournament    my  first  tournament  win  in  years      I  don't  know  what  is  is  but  this  remix  just  kind  of  sticks  with  me  now,74
4ZHwu0uut3k,UgwJj2LnHyg_0mJlw694AaABAg,I  really  miss  this  song    The  memory  it  brought  back        ,1
4ZHwu0uut3k,Ugx6Fcl3-Yl50mbStIt4AaABAg,This  song  touches  heart,1
4ZHwu0uut3k,UgySga6kYVl-CBS4BU94AaABAg,oh  man        still  hits  the  same    7  years  later  ,0
4ZHwu0uut3k,UgyvWvW2-Q2Xj4rGQ114AaABAg,I  like  how  everytime  I  wanna  listen  to  this  and  I  don't  remember  the  title    I  just  type    Cara  Delevingne  remix    and  it  comes  right  up  ,4
4ZHwu0uut3k,UgxIKjHrx8yoqAwTX-54AaABAg,My  first  time        Thank  you        No  words    just  dancing  ,0
4ZHwu0uut3k,UgwEWJcTBzNQaWc7G894AaABAg,Belter  track  lov  the  remix  ,1
4ZHwu0uut3k,UgwbFUSO2uaDBKiu2Ox4AaABAg,it  never  loses  its  heat  tho,0
4ZHwu0uut3k,UgwwWqWVdfEKcEK2pCh4AaABAg,I  love  the  song      i  love  cara    those  damn  eyes  ,8
4ZHwu0uut3k,UgyLPx1AfpyhtYx9tk94AaABAg,That's  the  thing  with  a  real  good  song      you're  still  listening  to  it    after  7  years          I  really  like  this  song      But  I  still  prefer  the  original  version      ,31
4ZHwu0uut3k,UgzJ7k9fKPg7RoGcYYV4AaABAg,This  song  just  feels  me  so  right      ,0
4ZHwu0uut3k,Ugz3ueukAiw-BSK_CJ14AaABAg,The  Song  makes  me  feel  like  I'm  alone  driving  my  car  in  the  night  thinking  about  this  song,1
4ZHwu0uut3k,UgwpJnfZyBwAgBBqMKZ4AaABAg,Nostalgia  is  the  best  and  worst  feeling  ever,392
4ZHwu0uut3k,UgxAxFw5W3FeFFmfCH14AaABAg,Sorry  but  I  really  just  can  t  stop  listen  this  always  on  the  mood,0
4ZHwu0uut3k,Ugw23umPevQWCrSqgtd4AaABAg,Super      puts  me  where  I  need  to  be,1
4ZHwu0uut3k,UgzbJioeNuJE1O0b_Ll4AaABAg,2018  crying  2020  stil  crying                      ,10
4ZHwu0uut3k,Ugwxgu7zGXZfCqi2MhF4AaABAg,POV    everyone  at  your  house  is  asleep  except  you  and  you  re  listening  to  this  song  on  a  rainy  night  while  leaning  your  head  against  the  window  and  watching  how  the  rain  drops  hits  the  window  and  you  slowly  start  to  tear  up          ,18
4ZHwu0uut3k,UgxthGbBHg3FHtqmIFV4AaABAg,2017    Listening  to  this  song  because  I  m  depressed  2020    listening  to  this  song  and  becoming  depressed  again,5
4ZHwu0uut3k,Ugx5m1hE-F3VWxzenWB4AaABAg,The  first  time  when  I  heard  this  song  was  5  years  ago  then  I  was  just  19        I  feel  so  nostalgic  now  and  want  that  times  to  be  back              ,2
4ZHwu0uut3k,UgzJE9cNwGUWLCTuAt94AaABAg,When  i  high  this  song  make  me  flyy  ,1
4ZHwu0uut3k,Ugzxjc7H3sM7OULBDpB4AaABAg,This  is  much  better  than  the  original    absolute  class  ,0
4ZHwu0uut3k,UgzVg3LcARZYFvVWlLB4AaABAg,This  song  ,0
4ZHwu0uut3k,UgwHdLXYbS82kcEdXSJ4AaABAg,  You  know  you  are  in  love  when  she  is  more  beautiful  in  concrete  reality  than  in  your  imagination        me  5  seconds  ago,3
4ZHwu0uut3k,Ugw-HVyeUDOf7Ouq1tN4AaABAg,Dude  those  memories  ,0
4ZHwu0uut3k,UgyVkELRQtZVhkCK2qh4AaABAg,This  song  is  soo  addicting  ,2
4ZHwu0uut3k,UgxirOovuhAjxEsTc-R4AaABAg,An  Awasome  Song      Really      ,0
4ZHwu0uut3k,Ugxtccha61uSq4Zs0bJ4AaABAg,Who  s  with  me  in  August  2020    Why  I  don't  know    but  when  I  listen  to  this  remix    bad  also  good  memories  remix  my  brain    ,753
4ZHwu0uut3k,UgyRnlUZo8bO4drCKT94AaABAg,The  only  sound  I  need  ,1
4ZHwu0uut3k,UgwKvSl8X9yOLAz6vDB4AaABAg,Takes  me  back  to  the  good  old  days  I  was  just  chilling  with  my  homies  and  we  used  to  had  a  good  time    We  went  outside  everyday  and  never  arrived  at  school    Smoked  some  pot  in  the  morning  and  hit  many  many  places    Even  if  that  was  a  time  I  had  many  problems  with  myself  and  the  stuff  I  did  I  miss  this  time  so  damn  much    Life  moves  on  way  to  fast  and  before  you  realise  the  time  is  over  and  it  will  never  be  the  same    Its  just  so  important  to  enjoy  the  time  and  live  in  the  moment    Ill  always  be  stuck  in  the  time  with  you    Wish  so  damn  hard  we  could  go  back    You  were  my  youth  and  today  my  greatest  memory  for  sure      '  ,8
4ZHwu0uut3k,Ugyp23C6urrAQGyeRpR4AaABAg,I  had  forgotten  about  this  gem  ,0
4ZHwu0uut3k,UgyPOauBc5aMSCBSkdN4AaABAg,I  like  this  remix  but  nothing  compares  to  the  original  version    the  feeling  is  just  not  the  same    Still    it's  good,0
4ZHwu0uut3k,UgwuCHJWCeTrJsT6MLJ4AaABAg,This  isn't  the  sound  I  need  ,1
4ZHwu0uut3k,Ugzkj218aK7NNWQLUmd4AaABAg,Beautiful  mix  and  Cara  Delevighe  in  cover        yeah  ,1
4ZHwu0uut3k,Ugx9U7ESDFVEueTbtLh4AaABAg,hearing  this  I  just  want  to  ride  my  bike  ahead  and  forget  about  everything,3
4ZHwu0uut3k,UgznR3M1YnRjll6DoeJ4AaABAg,Hey    Stranger  i  hope    u  have  a  great  day  ahead  Fr  u              Jst  remember  you  will  hit  many  bumps  along  the  way      Bt  U'll  keep  moving  on  that's  wht  matters  most        Enjoy  ur  moments      ,1
4ZHwu0uut3k,UgxnoGcM1iE2mKCWl9R4AaABAg,Promise  me  this  is  forever,1
